,tconst,title,genre1,numVotes,startYear,runtimeMinutes,averageRating,url,pays_prod,sypnosis,reco1,reco2,reco3,reco4,trailer_embed_url,complete_movie_embed_url
196,tt5966350,"Agatha, ma voisine détective",Animation,95,2017.0,77.0,6.2,https://m.media-amazon.com/images/M/MV5BM2RjOGExMDYtOGRmNS00YzI1LWE4MmYtNWM3YWEzY2RmZTkwXkEyXkFqcGdeQXVyMTk4MjUyMzA@.jpg,['Denmark'],"Ten-year old Agathe-Christine, or simply AC, fancy mysteries and from the basement in the building, where she has just moved in, she has established a small detective bureau",tt7105440,tt9037650,tt5502946,tt5822838,,https://Trailers.to/player/embed/imdb/tt5966350
197,tt7105440,Princess Emmy,Animation,85,2019.0,78.0,6.2,https://m.media-amazon.com/images/M/MV5BYTBhNWRmNWMtMzE1ZS00ODY4LTk4NTctNzI3ODQ3MjZkODM1XkEyXkFqcGdeQXVyMDU5MDEyMA@@.jpg,"['Germany', 'Belgium', 'United Kingdom', 'Denmark']","Princess Emmy is a young girl with a secret gift - she is the only one in the Kingdom of Kandis who can speak to horses. Up until now, life for Emmy has been wonderful: exploring and hanging out with her best friends - a stable full of amazing horses; spending time with her family at the castle and not having a care in the world. That is until her jealous, scheming cousin Gizana appears; challenging her at every turn, threatening Emmy's chances of becoming an officially inaugurated princess and generally making her life hell. And on top of all that, Emmy must undergo the ultimate test to earn the right to keep her gift. If she fails, she loses the gift and her best friends forever. There is a huge amount at stake for such a little girl.""]",tt9037650,tt5966350,tt5822838,tt5502946,https://www.youtube.com/embed/MIcDLhkmM1A,https://Trailers.to/player/embed/imdb/tt7105440
198,tt0298903,Heidi,Animation,78,2005.0,80.0,6.2,https://m.media-amazon.com/images/M/MV5BODQzNzA3MTU0MF5BMl5BanBnXkFtZTgwOTYxOTY2NjE@.jpg,"['United Kingdom', 'Canada', 'Germany']",Young orphan Heidi (Emma Bolger) stays with her grandfather (Max von Sydow) in the mountains.'],tt0768189,tt1754455,tt0166090,tt0163080,,https://Trailers.to/player/embed/imdb/tt0298903
199,tt0348878,Le mystère des jouets,Animation,68,2004.0,70.0,6.2,https://m.media-amazon.com/images/M/MV5BMTNiMmY4YjYtZjcyMC00N2Q1LWEyYTMtNjY4MDAyYzZjOTExXkEyXkFqcGdeQXVyNzg5OTk2OA@@.jpg,"['France', 'Luxembourg', 'South Korea']","Accompanied by his extraordinary confidant Doudou, T'choupi discovers with wonder the small village of the seaside where he will live. The beautiful days of summer, the beach, freedom - Very quickly, the holidays are rich in encounters and adventures. He shares with Doudou all the events of his life, where joy and jealousy mingle; the family is growing, T'choupi now has a little sister, Fanny. But a mysterious shadow disturbs the happiness of the village children by stealing their favorite toys. With Pilou and Lalou, his new friends, T'choupi will conduct a thrilling investigation to unmask the culprit.""]",tt0806139,tt0416908,tt0965409,tt1342403,,https://Trailers.to/player/embed/imdb/tt0348878
200,tt13029316,Ma mère est un gorille et alors?,Animation,67,2021.0,75.0,6.2,https://m.media-amazon.com/images/M/MV5BMDE4ZDM4YzMtYTZlOC00MTY5LWJlOTEtZWY4MmUxNGI2NDNhXkEyXkFqcGdeQXVyMzk2ODc3NTU@.jpg,"['Sweden', 'Norway', 'Denmark']","Jonna has lived at the orphanage all her life. One day a Gorilla comes and adopts her. It takes some time for Jonna to get used to her new mother, but just as everything starts becoming good, the local authorities threaten their existence.']",tt5966350,tt7105440,tt9037650,tt5313906,https://www.youtube.com/embed/ILsS7Nj5SQg,https://Trailers.to/player/embed/imdb/tt13029316
201,tt5822838,Julius et le Père Noël,Animation,60,2016.0,80.0,6.2,https://m.media-amazon.com/images/M/MV5BYzc3ZDA5OWItOTQ4MC00OGJlLTgyYjItMGMwODRiZjVhMDNhXkEyXkFqcGdeQXVyNTM3MDMyMDQ@.jpg,"['Denmark', 'Sweden']","Eight year old Julius lives at an orphanage and secretly believes in Santa Claus until he loses not only his belief in Santa but also himself. But then something strange happens, and suddenly Julius finds himself in a magic world",tt4955162,tt2371399,tt2946582,tt5502946,https://www.youtube.com/embed/1_RpbD4Kbao,https://Trailers.to/player/embed/imdb/tt5822838
202,tt0332029,Elmer et le dragon,Animation,22,1997.0,98.0,6.2,https://m.media-amazon.com/images/M/MV5BODEwNmQ1ZDQtMWNhYi00MWIxLTlkNzQtMmIwZjllM2Y3NzU5XkEyXkFqcGdeQXVyNjI4MTgwNzY@.jpg,['Japan'],"The little Elmer finds a strange Cat. She tells him about a little dragon who is being held captive on an island of weird animals. Elmer is on its way, and he actually finds the helpless dragon Boris. He needs his courage to help his new friend.::Marvin Pyritz']",tt0342882,tt0446958,tt0974662,tt2332523,https://www.youtube.com/embed/5obEfjUyr6k,https://Trailers.to/player/embed/imdb/tt0332029
203,tt4981636,"La 6ème, la pire année de ma vie !",Animation,8570,2016.0,92.0,6.1,https://m.media-amazon.com/images/M/MV5BNjQzMTczNjI0Ml5BMl5BanBnXkFtZTgwODY5MTY5OTE@.jpg,"['United States', 'Cambodia']","After his principal (Andy Daly) destroys his sketchbook, Rafe (Griffin Gluck) and his best friend Leo (Thomas Barbusca) decide to ""destroy his book"" and break every rule in the school\'s Code of Conduct",tt2332523,tt9648078,tt1671584,tt6992642,https://www.youtube.com/embed/jCAVBienXgg,https://Trailers.to/player/embed/imdb/tt4981636
204,tt0067148,Godzilla contre Hedora,Action,5410,1971.0,85.0,6.1,https://m.media-amazon.com/images/M/MV5BMjUzNzVlMzUtNDhiMi00MzUzLWE1YjEtY2I5NWJkODU1ODQ5XkEyXkFqcGdeQXVyNTMxMjgxMzA@.jpg,['Japan'],"An ever evolving alien life-form from the Dark Gaseous Nebula arrives to consume rampant pollution. Spewing mists of sulfuric acid and corrosive sludge, neither humanity or Godzilla may be able to defeat this toxic menace",tt0042189,tt1690470,tt1535430,tt8856470,https://www.youtube.com/embed/jdm8xgG5rR8,https://Trailers.to/player/embed/imdb/tt0067148
205,tt0885415,Niko - le petit renne,Adventure,3369,2008.0,80.0,6.1,https://m.media-amazon.com/images/M/MV5BNDc1MjA5MTIwN15BMl5BanBnXkFtZTgwNTI4Nzk0MjE@.jpg,"['Finland', 'Denmark', 'Germany', 'Ireland']","A young reindeer who suffers from vertigo learns to overcome his fear, takes flying lessons from a clumsy flying squirrel and heads to the North pole to save a troubled Santa and his fleet of flying reindeer",tt2231505,tt1606636,tt0293849,tt0297753,https://www.youtube.com/embed/NtZX7SOPDi4,https://Trailers.to/player/embed/imdb/tt0885415
206,tt5378092,Princesse Mila et le Sorcier au coeur de pierre,Animation,2360,2018.0,85.0,6.1,https://m.media-amazon.com/images/M/MV5BOTUyYmZhNzktNGJiOS00NDZlLWJmY2MtYTMzZjM5NGZmOGVhXkEyXkFqcGdeQXVyODQwNTU3MjU@.jpg,['Ukraine'],"A story from the age of valiant knights, beautiful princesses, and evil sorcerers. Ruslan, an artist who dreams of becoming a knight, meets and falls in love with the beautiful Mila, without realizing that she is the King's daughter.",tt5136164,tt3746824,tt7534136,tt8048384,https://www.youtube.com/embed/RDOPiR5IAaI,https://Trailers.to/player/embed/imdb/tt5378092
207,tt0078477,Les enfants de l'eau,Adventure,1319,1978.0,105.0,6.1,https://m.media-amazon.com/images/M/MV5BM2I0MzIxZmEtN2ZiNi00MDBlLWEzNmQtOWQ1ZGYxMmM5OWY3XkEyXkFqcGdeQXVyMDY4MzkyNw@@.jpg,"['Poland', 'United Kingdom']",This children's fantasy tells the story of a 12-year-old boy who discovers a complex underwater world where young children are held prisoner by an evil shark and an eel.,tt0074705,tt0103837,tt0056281,tt0098189,,https://Trailers.to/player/embed/imdb/tt0078477
208,tt2371399,Les Moomins sur la Riviera,Animation,1307,2014.0,80.0,6.1,https://m.media-amazon.com/images/M/MV5BNWQ3NDhhZjAtNWJiMy00YjY3LThlZjgtN2U5NzM5ZDUzNWM1XkEyXkFqcGdeQXVyMzQwODY4MzQ@.jpg,"['Finland', 'France']","The Moomins set sail for the Riviera, where, after a journey fraught with storms and desert island dangers, Snorkmaiden is dazzled by the attentions of a playboy and Moomin learns that jealousy's sting is the most painful of all.",tt4955162,tt5822838,tt5502946,tt2476096,https://www.youtube.com/embed/KXv8YdvgZ50,https://Trailers.to/player/embed/imdb/tt2371399
209,tt4955162,Barbie: Rock et royales,Animation,849,2015.0,80.0,6.1,https://m.media-amazon.com/images/M/MV5BNjhjYWZlNDctZGE3MS00NDYzLThmNDctZDc1ZGRkY2FlZWU1XkEyXkFqcGdeQXVyNDE5MTU2MDE@.jpg,['United States'],"Get ready to rock! In this upbeat musical, Barbie stars as Courtney, a princess whose world is turned upside down when she switches places with Erika, a famous rockstar",tt2371399,tt5822838,tt5502946,tt2476096,,https://Trailers.to/player/embed/imdb/tt4955162
210,tt9563632,"Wonderland, le royaume sans pluie",Adventure,721,2019.0,115.0,6.1,https://m.media-amazon.com/images/M/MV5BMTkwNTcyNjQtMDA2ZC00ZmQ5LTkzM2UtYzk5YzYzZTUyZTllXkEyXkFqcGdeQXVyMzQ3NTE0ODM@.jpg,['Japan'],"A girl without self-confidence meets a mysterious alchemist Hippocrates and his student Pipo who are on a mission to save the world. Together, they laid the groundwork for ""Wonderland"" and Akane is labeled as Wonderland\'s savior",tt9896916,tt1634003,tt8076344,tt2391821,https://www.youtube.com/embed/VdRaUmse47g,https://Trailers.to/player/embed/imdb/tt9563632
211,tt1606636,Les Moomins et la chasse à la comète,Adventure,552,2010.0,75.0,6.1,https://m.media-amazon.com/images/M/MV5BOTkwOTQ5NDgwNl5BMl5BanBnXkFtZTcwNTQ0MjE2Mw@@.jpg,"['Finland', 'United Kingdom', 'Poland']","One day Moomintroll notices that something strange has happened in the Moomin Valley - everything is grey; not just the sky and the river, but the trees, the ground, the Moominhouse, too! Moomintroll runs to ask the well-read Muskrat if he knows what is happening. Muskrat declares that this is the way things tend to look like before the earth faces an awful fate coming from the sky... With the help of his father, Moominpappa, Moomintroll and his worried friends build the best raft ever and start on a challenging journey to the observatory. The wise professors there must know what the threat from space is all about! The trek is not easy. The brave entourage, Moomintroll, Sniff and Snufkin face many obstacles, yet also meet new and old friends. But they make it to the observatory: the professor calculates that a ferocious comet will reach the Earth in four days, four hours, four minutes and 44 seconds. Maybe 4 seconds later. It's time to go back home as fast as they can - surviving an unexpected number of peculiar creatures and dangers on the way. Will they get everybody safe in time?::Filmkompaniet""]",tt3122122,tt1693039,tt3075214,tt0885415,,https://Trailers.to/player/embed/imdb/tt1606636
212,tt0166090,"Babar, roi des éléphants",Animation,527,1999.0,80.0,6.1,https://m.media-amazon.com/images/M/MV5BZjMyZjEzYjEtNjNhMy00MDM0LTk2MmUtYzViMjJjZjFjMDJkXkEyXkFqcGdeQXVyNzYyOTc1MDE@.jpg,"['Canada', 'France', 'Germany']","Based on the classic tale by Jean de Brunhoff, this fully-animated feature is the heart-warming story of a little orphan elephant named Barbar who grows up to be King of the Elephants",tt0163080,tt0298903,tt0258050,tt0768189,https://www.youtube.com/embed/Rvbv52h86UA,https://Trailers.to/player/embed/imdb/tt0166090
213,tt9037650,Les Elfkins: Opération pâtisserie,Animation,324,2019.0,78.0,6.1,https://m.media-amazon.com/images/M/MV5BNDY1YjY1MTAtMDUyNi00M2JmLTg1N2UtMjIyNTU3ZGQwY2VkXkEyXkFqcGdeQXVyMjMwODE4ODI@.jpg,['Germany'],"The legendary Elfkins (Heinzelmännchen) of Cologne were gnomes secretly helping craftsmen at night until they were ousted by a tailor's malevolent wife 200 years ago. This is the story of their return.""]",tt7105440,tt5966350,tt5502946,tt5822838,https://www.youtube.com/embed/xCHAF0GvV5c,https://Trailers.to/player/embed/imdb/tt9037650
214,tt0186449,Pinocchio dans l'espace,Adventure,259,1965.0,71.0,6.2,https://m.media-amazon.com/images/M/MV5BMzVmYTU0OGItN2I3Ni00NWFjLTkyYWItZTE2YjI0MzYzNGYxXkEyXkFqcGdeQXVyNzc5MjA3OA@@.jpg,"['Belgium', 'United States']","Pinocchio must prove himself as a real boy when he takes off to Mars with Nurtle in the capture of Astro, a flying killer space whale",tt0187687,tt0206366,tt0065106,tt0202239,,https://Trailers.to/player/embed/imdb/tt0186449
215,tt0299619,Bécassine: Le Trésor viking,Animation,116,2001.0,85.0,6.1,https://m.media-amazon.com/images/M/MV5BMTMyODk1ODY0M15BMl5BanBnXkFtZTcwMzY5Mjc3MQ@@.jpg,['France'],"Known and loved by generations of children, Pinchon's classic Bécassine is now a feature-length movie. A cross between Mary Poppins and Mr Bean, Bécassine is the nanny every child dreams of having ! Her mismatched green dress, white apron and red-and-white striped socks might look a little strange, but the gawky Bécassine is a truly lovable character. Her adventures begin when Bécassine arrives in Paris to take care of Charlotte, the daughter of one of her former charges. Bécassine and Charlotte get caught up in a fanatic and comical adventure filled with song and dance. They race from Paris to Marseilles to Ibiza and Lapland trying to unravel the mystery of what happened to Charlotte's father, Edmond. What is he running from ? What secret is he trying to protect ? Will Charlotte's family escape the evil clutches of Gaspard, a so-called family friend ?::Aline""]",tt0275876,tt0768189,tt0166090,tt0163080,,https://Trailers.to/player/embed/imdb/tt0299619
216,tt2332523,After School Midnighters,Animation,106,2012.0,95.0,6.1,https://m.media-amazon.com/images/M/MV5BZTVhMWFhNWEtYjljZS00Y2Q4LTg0NjItZDBmNmQwMzZiMGQwXkEyXkFqcGdeQXVyNjc5MDk0MzA@.jpg,['Japan'],"Three young girls visit a school filled with strange legends. They have an abrupt encounter with a human body anatomy model and a skeleton model. Both haunt the soon-to-be-demolished science room. Seeking revenge for being vandalized by the three girls, someone invites them to the school's midnight party in order to scare them. Together, they go on a quest to collect three mythical medals that can grant a wish and hopefully save the science room.""]",tt0974662,tt4981636,tt6992642,tt9648078,,https://Trailers.to/player/embed/imdb/tt2332523
217,tt0465502,Igor,Animation,23116,2008.0,87.0,6.0,https://m.media-amazon.com/images/M/MV5BNDYwNjM1ODkxOV5BMl5BanBnXkFtZTcwMTQyMzI5MQ@@.jpg,"['United States', 'France']","Animated fable about a cliché hunchbacked evil scientist's assistant who aspires to become a scientist himself, much to the displeasure of the rest of the evil science community.",tt1757912,tt2396690,tt1194618,tt1961324,https://www.youtube.com/embed/PhPQR0pYWUc,https://Trailers.to/player/embed/imdb/tt0465502
218,tt1230204,Le voyage extraordinaire de Samy,Adventure,7288,2010.0,88.0,6.1,https://m.media-amazon.com/images/M/MV5BYzliYTFmODUtMGQ1Ny00MGY2LTkwMTUtZjZkOGJhYTVhNzg5XkEyXkFqcGdeQXVyMTMxODk2OTU@.jpg,"['France', 'Belgium', 'United States']","A sea turtle, who was hatched in 1959, spends the next fifty years travelling the world, while it is being changed by global warming.']",tt4937208,tt2911342,tt1487931,tt0297753,https://www.youtube.com/embed/ZAg-6UCKrs4,https://Trailers.to/player/embed/imdb/tt1230204
219,tt0297753,Kaena: La prophétie,Adventure,3970,2003.0,85.0,6.0,https://m.media-amazon.com/images/M/MV5BMTIxNTUwMzk0MF5BMl5BanBnXkFtZTYwODE3MTY2.jpg,"['France', 'Canada']","On the distant planet Axis, Kaena, a rebellious, high-spirited teenage girl, will defy the High Priest and her people's ancestral beliefs to take a perilous journey and discover what dark secrets lie beyond the clouds.",tt1230204,tt0885415,tt0188506,tt0115509,https://www.youtube.com/embed/cRwTWgS40E8,https://Trailers.to/player/embed/imdb/tt0297753
220,tt0102813,"Omer, le roi des cabots",Animation,3038,1991.0,74.0,6.0,https://m.media-amazon.com/images/M/MV5BYmUyNWU3NjMtMzQ3NC00YjEyLWJlN2EtZjJhZGM0NjQwODBkXkEyXkFqcGdeQXVyNjExODE1MDc@.jpg,['United States'],A Vegas show dog gets ditched in the sticks and ends up working on a farm,tt0107289,tt0099733,tt0089042,tt0092917,https://www.youtube.com/embed/Yf4S8z6496w,https://Trailers.to/player/embed/imdb/tt0102813
221,tt0091584,Mon petit poney,Adventure,2612,1986.0,86.0,6.0,https://m.media-amazon.com/images/M/MV5BNDE3MjgwNGMtYTU1Yi00ZDlmLTk3OGUtMjM4ZWYyZmJjZmQ4XkEyXkFqcGdeQXVyNzc5MjA3OA@@.jpg,"['United States', 'Italy', 'South Korea']","Ponyland comes under attack from the Smooze, a massive purple ooze created by an evil witch who plans to destroy the ponies' annual spring festival.",tt3293426,tt0093743,tt0102184,tt7506236,https://www.youtube.com/embed/4PwIJXaCTvw,https://Trailers.to/player/embed/imdb/tt0091584
222,tt0074539,La Flûte à six schtroumpfs,Animation,1276,1976.0,90.0,6.0,https://m.media-amazon.com/images/M/MV5BOGFkNWI1YTYtNGUzMS00NWYzLWE0ZjYtNDZlZWU3MDVjMzdmXkEyXkFqcGdeQXVyNzc5MjA3OA@@.jpg,"['France', 'Belgium']","A villain named McCreep steals the Smurfs' magic flute, an instrument that makes people dance wildly, and uses it to rob them. The Smurf King sends out Peewit to track down the thief and retrieve the flute.",tt0212115,tt0084060,tt0258438,tt0075011,https://www.youtube.com/embed/bciaEj-hNyA,https://Trailers.to/player/embed/imdb/tt0074539
223,tt5502946,Barbie: Aventure dans les étoiles,Animation,702,2016.0,79.0,6.0,https://m.media-amazon.com/images/M/MV5BYzU5MTQ0ODctMTc0OS00ZGY2LWI1MzctODVlYzBlNGY4ZGEwXkEyXkFqcGdeQXVyNDE5MTU2MDE@.jpg,['United States'],"Barbie, a space Princess, sees her world rapidly change when the stars in the sky begin to fade away. On her fascinating voyage to a new planet, she joins forces with a special rescue team. Is cosmic Barbie the hero the universe needs",tt4955162,tt2476096,tt2371399,tt9037650,https://www.youtube.com/embed/db08lvsxJmw,https://Trailers.to/player/embed/imdb/tt5502946
224,tt0054265,"Alakazan, le petit Hercule",Adventure,426,1960.0,88.0,6.0,https://m.media-amazon.com/images/M/MV5BMjA5NDg5MDkzOV5BMl5BanBnXkFtZTgwMTY3MDkwMzE@.jpg,['Japan'],"A monkey king who learns the secrets of magic goes on a spree and causes no end of aggravation for the gods, who finally imprison him. In order to make up for all the trouble he's caused, he is sent on a mission to accompany a prince who is the son of the gods on a journey through a land filled with dangers, monsters, cannibals and demons.::frankfob2@yahoo.com""]",tt0053275,tt0056281,tt0225145,tt3293426,https://www.youtube.com/embed/gYWn0V-Nsf8,https://Trailers.to/player/embed/imdb/tt0054265
225,tt8048384,Capitaine Dent de Sabre et le diamant magique,Animation,344,2019.0,81.0,6.0,https://m.media-amazon.com/images/M/MV5BMzk2YmJkZmItY2IyYi00N2JjLWEwNWUtMjgwZDVkMWY2Zjc2XkEyXkFqcGdeQXVyNjYxNzY5MjE@.jpg,['Norway'],"Two young pirates on the search for a lost brother, a vampire with heavy sunburns, a shape shifting queen and a raging ape army. Captain Sabertooth will face plenty of challenges when he sets out to find a lost magic diamond.']",tt5502946,tt4955162,tt5822838,tt9037650,https://www.youtube.com/embed/IHEH8voOdEo,https://Trailers.to/player/embed/imdb/tt8048384
226,tt4937208,Abulele au pays des hommes,Adventure,279,2015.0,90.0,6.0,https://m.media-amazon.com/images/M/MV5BMTEwMjM3MTM5NjZeQTJeQWpwZ15BbWU4MDU3NTIxOTkx.jpg,['Israel'],"A boy struggles at home and at school with bullies after his brother is killed. When he befriends and shelters a mythical creature, it helps him outsmart his tormenters and overcome his grief",tt1230204,tt9204164,tt2911342,tt2288005,https://www.youtube.com/embed/U9VgKkuCafU,https://Trailers.to/player/embed/imdb/tt4937208
227,tt0768189,Felix 2 - The Mechanical Rabbit and the Time Machine,Animation,59,2006.0,82.0,6.0,https://m.media-amazon.com/images/M/MV5BN2Q0ZjcxMDMtNTgwZi00YzRjLWI1ZDctOWNmMTNkMThiMDZhXkEyXkFqcGdeQXVyMjE4MTIyNDI@.jpg,"['Germany', 'Italy']","Sophie and her family are visiting the city Museum of Natural Sciences where Prof. Snork is working on a new time machine - Suddenly the whole machine starts to shake and, with a bright flash of light, a tiny mammoth named Woolly and a sea turtle by the name of Gertrude materialize next to Felix. All three of them are then catapulted into a journey through time in which they face prehistoric cavemen and even meet Queen Nefertiti in ancient Egypt. However, the return home will not be easy, as Sophie and Prof. Snork work on getting the machine back to the present. Meanwhile, Felix is hosted by the Vikings, meets a whale, comes to know the peoples of the Native Americas and goes adventuring on a Pacific island. Felix and Wolly even participate in a medieval tournament before returning to the safety of Sophie's arms.""]",tt0298903,tt0163080,tt0299619,tt1764666,,https://Trailers.to/player/embed/imdb/tt0768189
228,tt7506236,"Jeannette, la petite souris",Adventure,7,1985.0,78.0,6.0,https://m.media-amazon.com/images/M/MV5BNzFmYWQzNGUtZGM4My00ODg1LWI3ZGEtMzc4MjIzZWRiYmU2XkEyXkFqcGdeQXVyMjc0NzgzMDQ@.jpg,['Poland'],"Margo is a little mouse that lives quietly in a tree. It is her house. Life in the tree runs smoothly, but there are people who are not willing to make life easy for Margo",tt0090961,tt3293426,tt0091584,tt0101329,,https://Trailers.to/player/embed/imdb/tt7506236
229,tt0137201,"Rudolph, le petit renne au nez rouge: Le film",Adventure,2678,1998.0,92.0,5.9,https://m.media-amazon.com/images/M/MV5BZjQyMmQ0OTQtZTBjZC00OTNjLWFiNGEtOTQxNWIyOGVhMGVlXkEyXkFqcGdeQXVyNzY1NDgwNjQ@.jpg,"['United States', 'Canada']",It's up to Santa's most famous reindeer to save the day when an evil queen conjures up a storm on Christmas.,tt0233691,tt0103837,tt0297753,tt0122494,,https://Trailers.to/player/embed/imdb/tt0137201
230,tt0293849,"Plume, le petit ours polaire",Adventure,731,2001.0,78.0,5.9,https://m.media-amazon.com/images/M/MV5BODgxNjYzNzA1OF5BMl5BanBnXkFtZTgwMDUwNjgwMzE@.jpg,['Germany'],"Lars is a young polar bear who finds the big, frosty world just a little overwhelming. Then he meets Robbie, who's funny, friendly, and a seal!""]",tt0188506,tt0885415,tt0146063,tt1180335,https://www.youtube.com/embed/HKWKmXvlbPg,https://Trailers.to/player/embed/imdb/tt0293849
231,tt0163080,Le gâteau magique,Animation,480,2000.0,80.0,5.9,https://m.media-amazon.com/images/M/MV5BMTBkZDRjNmQtY2ViYi00ODc2LTg3MWMtMjQ4MTI1YTViMDFlXkEyXkFqcGdeQXVyNjg5MjU3NjE@.jpg,"['Australia', 'New Zealand']","An old man, a young anthropomorphic koala, a South Pole penguin and Albert, a magic sentient walking and talking bowl of pudding with an attitude are searching for koala's missing parents. However, sinister forces want the pudding.""]",tt0166090,tt0258050,tt0768189,tt0298903,https://www.youtube.com/embed/1xitN_sMcsc,https://Trailers.to/player/embed/imdb/tt0163080
232,tt6992642,El Hubiera Sí Existe,Animation,312,2019.0,96.0,5.9,https://m.media-amazon.com/images/M/MV5BNGQxZjQ1MTktZTJhZC00M2FlLWJiOTgtNDYyZmU3MDQ2ZmJmXkEyXkFqcGdeQXVyMzQzNDEwMTQ@.jpg,['Mexico'],"You are responsible to make your future but sometimes we have to let go and risk the consequences, which could be love, work or future decisions.']",tt9648078,tt2332523,tt4981636,tt9679528,,https://Trailers.to/player/embed/imdb/tt6992642
233,tt0075011,Le monde merveilleux de cendrillon,Animation,161,1973.0,83.0,5.9,https://m.media-amazon.com/images/M/MV5BNTllMmVjZTgtMTkyYi00ZmJjLTliMTYtNzA4NGRhNzY3ZjdiXkEyXkFqcGdeQXVyNzc5MjA3OA@@.jpg,"['West Germany', 'Italy']","One day, Maria meets a prince who gives her a magic stone but then her stepsister steals it and throws it down a well. While trying to retrieve the stone, Maria falls in and awakens in a magical realm",tt0074539,tt0239634,tt0076593,tt0166948,,https://Trailers.to/player/embed/imdb/tt0075011
234,tt2476096,Le Coq de St-Victor,Animation,132,2014.0,80.0,5.9,https://m.media-amazon.com/images/M/MV5BNzMzNjA0MjAyMl5BMl5BanBnXkFtZTgwOTg3MTI1MjE@.jpg,['Canada'],"In this fun family comedy, a village rooster's punctual (and loud!) crowing keeps everyone awake until a group of sleepy locals hatch a scheme to get rid of him.""]",tt5502946,tt2371399,tt4955162,tt3921852,https://www.youtube.com/embed/CTdrdwUqyLY,https://Trailers.to/player/embed/imdb/tt2476096
235,tt0280030,Peter Pan 2 : Retour au Pays imaginaire,Adventure,19630,2002.0,72.0,5.8,https://m.media-amazon.com/images/M/MV5BYWMwMWQ5NWQtYTA1YS00OTQ5LWExZmItNGI5MzIyMWRhNDA5XkEyXkFqcGdeQXVyMTQxNzMzNDI@.jpg,"['United States', 'Canada', 'Australia']","In London during World War II, this is the story of Wendy's daughter, Jane, who is kidnapped by Captain Hook and Peter Pan must come to the rescue.",tt0293849,tt0146063,tt1606636,tt1381803,https://www.youtube.com/embed/e44-lodp6vY,https://Trailers.to/player/embed/imdb/tt0280030
236,tt3746824,Gare aux loups,Animation,3135,2016.0,85.0,5.8,https://m.media-amazon.com/images/M/MV5BOWFiMTMyOGMtN2UzMC00OGJmLThmNjAtNmE2ZTE2ZGE0NDgxXkEyXkFqcGdeQXVyNTczOTM5MTQ@.jpg,['Russia'],The young wolf Grey is transformed into a sheep by a mage who has given him a wish. Now he must gain the trust of the sheep colony and protect them from an impending attack of the wolves,tt2396690,tt5378092,tt1757912,tt2091947,https://www.youtube.com/embed/vX5tltuCJMk,https://Trailers.to/player/embed/imdb/tt3746824
237,tt9204164,Bigfoot Family,Adventure,2373,2020.0,89.0,5.8,https://m.media-amazon.com/images/M/MV5BMjNkYjUzODItNGM3ZS00Y2JjLWI2OTUtZjZmYjkzZTQzMTdmXkEyXkFqcGdeQXVyNjYxNzY5MjE@.jpg,"['Belgium', 'France']","Follow up to Son of Bigfoot: Father uses his new fame to fight against an Alaska oil company but when he disappears the son, the mother, a raccoon and a bear head North to rescue him.']",tt4937208,tt11231280,tt5746054,tt1487931,https://www.youtube.com/embed/Afp7efbYH7A,https://Trailers.to/player/embed/imdb/tt9204164
238,tt2396690,Barbie : La Princesse et la Popstar,Animation,1816,2012.0,86.0,5.8,https://m.media-amazon.com/images/M/MV5BNDRmMWU2ZjMtM2NlMy00OThkLTgwNDgtYTFkOGZmMGY2MzZmXkEyXkFqcGdeQXVyNDE5MTU2MDE@.jpg,['United States'],"When the gracious young Princess, Tori, trades places with her favourite singer, Keira, the girls will have to work together to save the realm of Meribella. Will the Princess and the Pop Star learn to appreciate the power of uniqueness",tt1757912,tt1961324,tt3746824,tt1764666,https://www.youtube.com/embed/26_jLHf5I3g,https://Trailers.to/player/embed/imdb/tt2396690
