,tconst,title,genre1,numVotes,startYear,runtimeMinutes,averageRating,url,pays_prod,sypnosis,reco1,reco2,reco3,reco4,trailer_embed_url,complete_movie_embed_url
239,tt1757912,"Titeuf, le film (3D)",Animation,623,2011.0,87.0,5.8,https://m.media-amazon.com/images/M/MV5BMTMxNjg1Nzk3Nl5BMl5BanBnXkFtZTcwMzgzODI5NA@@.jpg,['France'],"Titeuf is a famous character from comics and animation series. In this movie - Titeuf's life never been worse- Nadia didn't invite him to her birthday party, his parent's are close to be deported - and everything looks so bad. No one can solve the problems now but Titeuf in his funny ways ... Or maybe he'll fail too?::yaronbern (Katzar Hanan)""]",tt2396690,tt1961324,tt1194618,tt3746824,,https://Trailers.to/player/embed/imdb/tt1757912
240,tt0188506,Le château des singes,Adventure,442,1999.0,80.0,5.8,https://m.media-amazon.com/images/M/MV5BMTIzMDA3NjY5M15BMl5BanBnXkFtZTYwMDAzNzk5.jpg,"['France', 'United Kingdom', 'Germany', 'Hungary']",A rebellious teenage monkey refuses to believe what he has been told and sets out to find the truth.'],tt0293849,tt0115509,tt1180335,tt0297753,,https://Trailers.to/player/embed/imdb/tt0188506
241,tt0258050,Prop & Berta,Animation,265,2000.0,77.0,5.8,https://m.media-amazon.com/images/M/MV5BNjI3NDE2ODkzN15BMl5BanBnXkFtZTgwMzg0OTk1MDE@.jpg,['Denmark'],"Prop & Berta is the story of a friendship between a little stout man and a big and proud cow, who are able to talk to each other. Together they confront an ugly and evil witch who is determined to get rid of them because they have moved into a house on the edge of her wood. The witch hates neighbours and through magic and evil planning she turns Prop and Berta's friends, the Teeny burpers, into dangerous hoodlums who begin to terrorize the nearby town. Prop and Berta manage to overcome the witch and turn her into a good person, restoring peace in the little town and breaking the spell which binds their friends.::Anonymous""]",tt0163080,tt0120733,tt0166090,tt0400771,,https://Trailers.to/player/embed/imdb/tt0258050
242,tt9648078,Ashita sekai ga owaru toshitemo,Animation,234,2019.0,93.0,5.8,https://m.media-amazon.com/images/M/MV5BMDg4NjFiYjAtMDJiOC00OTI5LWIwYjctYjgxZGIzN2Y2YzFlXkEyXkFqcGdeQXVyNzEyMDQ1MDA@.jpg,['Japan'],"Shin has shut his heart ever since his mother died when he was young. His childhood friend Kotori has been looking after him ever since. Now that they are in the third year of high school, and it seems like they can finally move forward, another Shin from another Japan has suddenly appeared in front of them.']",tt6992642,tt9679528,tt4981636,tt2332523,https://www.youtube.com/embed/6ibT1yGReP4,https://Trailers.to/player/embed/imdb/tt9648078
243,tt11231280,Félix et le trésor de Morgäa,Adventure,173,2021.0,85.0,5.8,https://m.media-amazon.com/images/M/MV5BM2IzMDgwOTItMzNiZi00MDllLWIwNDktNTY4OTA2MGQxNmQyXkEyXkFqcGdeQXVyMjMwODE4ODI@.jpg,['Canada'],"Taking advantage of his mother's absence as she departs on a cruise ship for some rest and relaxation, 12-year-old Félix sets out to find his father, a fisherman who disappeared at sea two years earlier.",tt9204164,tt1487931,tt2766104,tt8524650,https://www.youtube.com/embed/hDjOCiWnB0o,https://Trailers.to/player/embed/imdb/tt11231280
244,tt0145853,Jeannot l'intrépide,Animation,101,1950.0,80.0,5.8,https://m.media-amazon.com/images/M/MV5BMGQ4NzVmZTgtMmRhZS00ZWMzLWI3ZDItZWNjNmI0MzhiNDFiL2ltYWdlXkEyXkFqcGdeQXVyNzA4ODc3ODU@.jpg,['France'],"Johnny sets out to rid the land of an evil giant but the giant uses a machine to reduce Johnny to the size of a bee. He is welcomed into Bee-Land, and herocially defends the Queen Bee. Johnny then leads the bees and their friends in an attack against the giant, uses the machine to reduce the giant to a miniature and restores himself to human size.::Les Adams <longhorn1939@suddenlink.net",tt0040580,tt0052527,tt0051694,tt0041890,,https://Trailers.to/player/embed/imdb/tt0145853
245,tt0167770,Dot et le Père Noël,Animation,80,1981.0,75.0,5.8,https://m.media-amazon.com/images/M/MV5BMTIyMDk3ODg3OV5BMl5BanBnXkFtZTcwMzc4MTkyMQ@@.jpg,['Australia'],"In search of a kangaroo, a little girl receives help from Santa Claus.']",tt0239634,tt0089793,tt0099733,tt0102813,,https://Trailers.to/player/embed/imdb/tt0167770
246,tt3293426,Deux ans de vacances,Adventure,31,1982.0,85.0,5.8,https://m.media-amazon.com/images/M/MV5BZGU1OWVkZjktNWUyNS00NWYxLTkzMGUtY2ZkYmIxYWU4Y2JhXkEyXkFqcGdeQXVyNzMzMjU5NDY@.jpg,['Japan'],"A troop of children from eight to thirteen, abandoned on an island, struggling for life in the midst of passion fueled by the differences of nationalities. A story in the style of Robinson Crusoe revisited by Jules Verne.']",tt0091584,tt7506236,tt0115509,tt0093743,,https://Trailers.to/player/embed/imdb/tt3293426
247,tt1487931,Khumba,Adventure,5942,2013.0,85.0,5.7,https://m.media-amazon.com/images/M/MV5BMTQyNTgzODU1N15BMl5BanBnXkFtZTgwMjg4NjQxMDE@.jpg,['South Africa'],"Rejected by his superstitious herd, a half-striped zebra embarks on a daring quest to earn his stripes but finds the courage and self-acceptance to save all the animals of the Great Karoo",tt1230204,tt2766104,tt11231280,tt9204164,https://www.youtube.com/embed/rN0gwblPifo,https://Trailers.to/player/embed/imdb/tt1487931
248,tt8856470,Pokémon: Mewtwo contre-attaque - Evolution,Action,5097,2019.0,98.0,5.7,https://m.media-amazon.com/images/M/MV5BZDA0NGEwNDItMDM5OC00ZmY4LTk1ZGQtMzE4ZmVhY2M3MzY0XkEyXkFqcGdeQXVyOTA1ODU0Mzc@.jpg,"['Japan', 'United States']","After a scientific experiment leads to the creation of a clone of Mewtwo, he sets out to destroy the world. Ash and his friends then decide to thwart Mewtwo's evil plans.""]",tt1690470,tt1535430,tt0067148,tt0042189,https://www.youtube.com/embed/D0zYJ1RQ-fs,https://Trailers.to/player/embed/imdb/tt8856470
249,tt0099733,Blanche Neige et le château hanté,Animation,2334,1989.0,75.0,5.7,https://m.media-amazon.com/images/M/MV5BMWE5MDY3NjQtODY5Ni00MTFkLTgzYjktZDNiOWYxNDU4Yjg2XkEyXkFqcGdeQXVyNzc5MjA3OA@@.jpg,['United States'],Snow White and her new friends must rescue the Prince when he is captured by the Wicked Queen's vengeful brother.,tt0102813,tt0089793,tt0167770,tt0114349,https://www.youtube.com/embed/2vjQuoX40GU,https://Trailers.to/player/embed/imdb/tt0099733
250,tt2630134,Barbie: Rêve de danseuse étoile,Animation,1547,2013.0,75.0,5.7,https://m.media-amazon.com/images/M/MV5BMzk4NzhiNGYtMGU0Ni00MjA1LWEyMzgtNTUxOGE2MDg3MjEyXkEyXkFqcGdeQXVyNDE5MTU2MDE@.jpg,['United States'],About a young girl who finds a pair of pink ballet shoes and is taken to a magical ballet land.There she learns how to help her friends and follow her instincts,tt1395050,tt1600529,tt2534642,tt12767498,https://www.youtube.com/embed/Ym9Pdjt-fBI,https://Trailers.to/player/embed/imdb/tt2630134
251,tt3921852,Barbie et la porte secrète,Animation,1207,2014.0,81.0,5.7,https://m.media-amazon.com/images/M/MV5BYTMwODAxMjMtMGI2Yy00ZTI2LTk4ZDktNTZlNzA4NDE0OWJhXkEyXkFqcGdeQXVyNDE5MTU2MDE@.jpg,['United States'],"Alexa is a very shy princess from a contemporary, modern kingdom who discovers a secret door that opens to a magical land",tt4764566,tt2476096,tt1764666,tt5848640,https://www.youtube.com/embed/azhDCKCm750,https://Trailers.to/player/embed/imdb/tt3921852
252,tt1961324,Pokémon 14: Noir - Victini et Reshiram,Animation,1064,2011.0,88.0,5.7,https://m.media-amazon.com/images/M/MV5BYzc4ZDM4MjgtMTIxNy00MWUxLTk4ZDctZjczOWM2ZGVmMGE5XkEyXkFqcGdeQXVyOTA1ODU0Mzc@.jpg,['Japan'],"Victini, a legendary Pokémon, unable to leave the boundaries of its hometown, is targeted by a determined villager to restore the homelands of his ancestors.']",tt1757912,tt1194618,tt2396690,tt2091947,https://www.youtube.com/embed/pJGcJNkzWIM,https://Trailers.to/player/embed/imdb/tt1961324
253,tt0089793,Polo en Amérique,Animation,449,1985.0,78.0,5.7,https://m.media-amazon.com/images/M/MV5BMjU4NTU4NjMtZTUwYy00MzdmLTgwZTEtOTkyNDg3Y2U1MWI5XkEyXkFqcGdeQXVyOTc5MDI5NjE@.jpg,['Sweden'],"Pelle is a cat who was born without a proper tail. He compensates this by studying hard and, much to the dismay of his archrival Måns, receives a fancy degree very few cats in Sweden have obtained. Some time later he is visited by his relative Pelle Swanson who invites him over to visit his new home country America. There everything is bigger, even the rats are much fatter. Everything seems possible in America, even the prospect of finally having a proper tail and a sweetheart to call one's own.::Markku Kuoppamäki""]",tt0099733,tt0167770,tt0099878,tt0239634,,https://Trailers.to/player/embed/imdb/tt0089793
254,tt1764666,Le petit train bleu,Animation,362,2011.0,83.0,5.7,https://m.media-amazon.com/images/M/MV5BNTI3NDFmZDctMmJkNi00OGRiLWFjZTAtNjk1MzAyNTRhNDY4XkEyXkFqcGdeQXVyMTY5Nzc4MDY@.jpg,['United States'],"Featuring an all-star cast, the timeless story comes to life in this all-new, feature-length film filled with fun and adventure!']",tt3921852,tt2396690,tt3746824,tt2091947,,https://Trailers.to/player/embed/imdb/tt1764666
255,tt1194618,Moomin et la folle aventure de l'été,Animation,206,2008.0,88.0,5.7,https://m.media-amazon.com/images/M/MV5BMTEwODAxNjU4NTdeQTJeQWpwZ15BbWU4MDE3ODExMDIx.jpg,"['Finland', 'Austria', 'Poland']","A peaceful summer day in the Moomin Valley is interrupted by a volcanic eruption. At the last minute the Moomin family finds refuge in a strange house. It turns out it's not an ordinary house but a theatre stage where the Moomin Family begins to write a play.::American Film Market""]",tt1961324,tt1757912,tt2396690,tt2091947,,https://Trailers.to/player/embed/imdb/tt1194618
256,tt9679528,Combat Wombat,Animation,169,2020.0,90.0,5.7,https://m.media-amazon.com/images/M/MV5BZjYyN2Y5YWUtMDI5Zi00YjkwLWFlN2QtMjZlNjVhODZhYWI3XkEyXkFqcGdeQXVyMTIyNDUxNDU5.jpg,['Australia'],"Maggie Diggins, a wombat turned Wonder Woman, unintentionally becomes the city's superhero after she begrudgingly saves a rookie superhero sugar glider from certain doom.""]",tt9648078,tt7531096,tt4981636,tt3746824,https://www.youtube.com/embed/KQhW254FVac,https://Trailers.to/player/embed/imdb/tt9679528
257,tt0115509,Charlie 2,Adventure,5884,1996.0,82.0,5.6,https://m.media-amazon.com/images/M/MV5BMzQ5NzdkOWEtNjg3Yi00NzY1LWE1NzItOWFiOGFiYzRiYmJjXkEyXkFqcGdeQXVyNzc5MjA3OA@@.jpg,"['United States', 'Ireland']","Charlie and Itchy return to Earth to find Gabriel's Horn, but along the way meet up with a young boy named David, who ran away from home.",tt0188506,tt0293849,tt1180335,tt0297753,https://www.youtube.com/embed/muR5N_9p3RY,https://Trailers.to/player/embed/imdb/tt0115509
258,tt0099878,"Les Jetsons, le film",Animation,5101,1990.0,82.0,5.6,https://m.media-amazon.com/images/M/MV5BMGQ3MGRhZTAtZDEwYy00NjBhLTkzNDktYzY4M2JjZDQxMmRhXkEyXkFqcGdeQXVyMzM4MjM0Nzg@.jpg,"['United States', 'Taiwan', 'Philippines', 'China']",George Jetson is forced to uproot his family when Mr. Spacely promotes him to take charge of a new factory on a distant planet,tt0166948,tt0114349,tt0089793,tt0259929,https://www.youtube.com/embed/DxQE-7_CIJ4,https://Trailers.to/player/embed/imdb/tt0099878
259,tt2288005,Sammy 2,Adventure,2220,2012.0,92.0,5.6,https://m.media-amazon.com/images/M/MV5BMTkzNjc2MDIwOV5BMl5BanBnXkFtZTgwODMwNzA2MDE@.jpg,"['Belgium', 'United States', 'France', 'Italy']","Sammy and Ray, leatherback turtles and friends forever, are enjoying an atoll's water and sand, shepherding new hatchlings Ricky and Ella out to sea. Suddenly, a poacher swoops in and ships them off to be part of a spectacular aquarium show for tourists in Dubai. The kingpin of the place, Big D the seahorse, enlists them in his plans for a great escape. But with their new friends Jimbo the bug-eyed blob fish and Lulu the snippy lobster, Annabel the sweet Octopus, and a whole family of penguins, Sammy and Ray hatch breakout plans of their own. That is when little Ricky and Ella arrive, determined to break in to rescue them. After a series of thrilling adventures and narrow escapes, our heroes head south to meet up with Shelly, Sammy's first and only love.::safwan""]",tt5746054,tt3257582,tt1647446,tt4937208,https://www.youtube.com/embed/uSEVHO_k9Z8,https://Trailers.to/player/embed/imdb/tt2288005
260,tt1381803,L'Ours Montagne,Adventure,590,2011.0,75.0,5.6,https://m.media-amazon.com/images/M/MV5BNDIzMDQzNjctY2VhMi00NGY2LTlhYTUtNTNjZmM1NDVmOWZiXkEyXkFqcGdeQXVyMTY5Nzc4MDY@.jpg,['Denmark'],"Jonathan spends his vacations alone with his grandfather on the edge of a forest populated by mythical animals. This year his kid sister Sophie joins. When she disappears, he has to venture into the heart of the forest to rescue her",tt2243621,tt1606636,tt1180335,tt3122122,https://www.youtube.com/embed/4z4OAMqF-rI,https://Trailers.to/player/embed/imdb/tt1381803
261,tt0233691,Le cercle enchanté,Adventure,491,1999.0,90.0,5.6,https://m.media-amazon.com/images/M/MV5BMjAzMzE1NjUwMV5BMl5BanBnXkFtZTcwMjYzMjIyMQ@@.jpg,"['United Kingdom', 'Hong Kong', 'United States']",Two children holidaying on a farm are transported to Fairyland but after one eats a charmed fairy-cake they are given three tasks to complete before they can return to their own world.'],tt0137201,tt0114556,tt0377119,tt0297753,,https://Trailers.to/player/embed/imdb/tt0233691
262,tt0166948,American Rabbit,Animation,442,1986.0,85.0,5.6,https://m.media-amazon.com/images/M/MV5BZDZiODQ0MzEtYmQ0NS00MTI4LTlmNWYtYWQ4NDg2MjZmZDU1XkEyXkFqcGdeQXVyNzc5MjA3OA@@.jpg,"['Japan', 'United States']","To fight evil, a young rabbit can transform into a star spangled superhero",tt0099878,tt0089793,tt0114349,tt0075011,https://www.youtube.com/embed/V1oTv6hJQz8,https://Trailers.to/player/embed/imdb/tt0166948
263,tt12767498,Barbie : Dans la peau d'une princesse,Animation,355,2020.0,72.0,5.6,https://m.media-amazon.com/images/M/MV5BOWIyN2Y5NmYtMzdjZi00MzcyLWI2NzgtNjM4NmJmZTcwNDJkXkEyXkFqcGdeQXVyNzQyNTU2MjI@.jpg,['Netherlands'],"With new friends in a new kingdom, Barbie learns what it means to be herself when she trades places with a royal lookalike in this musical adventure",tt2630134,tt7454138,tt2034832,tt2534642,https://www.youtube.com/embed/ww280Q69I3k,https://Trailers.to/player/embed/imdb/tt12767498
264,tt0120733,Le lion d'Oz,Animation,344,2000.0,74.0,5.6,https://m.media-amazon.com/images/M/MV5BMTI5NjM2NDEzMl5BMl5BanBnXkFtZTcwODYxMDEyMQ@@.jpg,['Canada'],"A circus lion (Jason Priestley) finds himself in a magical land where he becomes the leader of a journey to stop the Wicked Witch of the East (Lynn Redgrave), a task which may lead him to lose a part of himself",tt0400771,tt0258050,tt0116728,tt0206367,,https://Trailers.to/player/embed/imdb/tt0120733
265,tt4764566,Le Noël de Pettson & Picpus,Animation,319,2016.0,80.0,5.6,https://m.media-amazon.com/images/M/MV5BZWZiZjQyNTItMTY1My00MzE2LWI0YzYtZmQxMTc3ZWVlMTFlXkEyXkFqcGdeQXVyMjQ3NzUxOTM@.jpg,['Germany'],"Pettson promised Findus they would have the best christmas ever this year, but then everything goes wrong. Findus is afraid that Christmas is going to be cancelled at all. So he tries to get help on his own.']",tt2534642,tt5848640,tt3921852,tt2476096,,https://Trailers.to/player/embed/imdb/tt4764566
266,tt2534642,Capitaine Morten et la reine des araignées,Animation,188,2018.0,79.0,5.6,https://m.media-amazon.com/images/M/MV5BN2EyMzA4Y2MtMzcwYS00YmFkLWI1MDUtNTQ3YzYxNzhiOGEwXkEyXkFqcGdeQXVyNjk4MzY1MTk@.jpg,"['Estonia', 'Belgium', 'Ireland', 'United Kingdom']",Every ship deserves its captain.'],tt4764566,tt5848640,tt3921852,tt2476096,https://www.youtube.com/embed/wUPhjAlNVbE,https://Trailers.to/player/embed/imdb/tt2534642
267,tt1395050,3 amis mènent l'enquête,Animation,182,2009.0,77.0,5.6,https://m.media-amazon.com/images/M/MV5BMjEwNzc4NTY1OV5BMl5BanBnXkFtZTcwMzg4ODAwMw@@.jpg,"['Germany', 'Italy', 'France']","The unsuccessful actor and vagabond Johnny Mauser needs a change from all the trouble that he has experienced while living in the city. The perfect place to take a little break seems to be in Mullewapp, a little village with a cosy little farm. Soon he becomes friends with Franz von Hahn and Waldemar. And when the sheep Cloud suddenly disappears, the three new friends have to manage their first adventure.::Kinowelt']",tt2630134,tt0402438,tt0400771,tt1600529,https://www.youtube.com/embed/pfRbGYBlBCw,https://Trailers.to/player/embed/imdb/tt1395050
268,tt3394878,Les aventures d'Emile à la ferme,Animation,100,2013.0,63.0,5.6,https://m.media-amazon.com/images/M/MV5BODNkZjVlZDgtY2Q5ZS00MDBmLWE2MzUtMTU5ZmEwM2UxMzgxXkEyXkFqcGdeQXVyMTQzMjU1NjE@.jpg,['Sweden'],"An animated movie that follows the adventures of Emil, who lives on a farm in a Swedish village with his parents and little sister.']",tt6562798,tt2034832,tt12767498,tt11015752,https://www.youtube.com/embed/3f5YwGxNAHM,https://Trailers.to/player/embed/imdb/tt3394878
269,tt0940656,Arthur 3 : La Guerre des deux mondes,Adventure,8807,2010.0,101.0,5.5,https://m.media-amazon.com/images/M/MV5BODkwNzc4ODYtMWJmMS00N2NkLTgxYWEtMzM3MmIwMWJlMGVjXkEyXkFqcGdeQXVyNDgyODgxNjE@.jpg,['France'],"With Maltazard now seven feet tall and Arthur still two inches small, our hero must find a way to grow back to his normal size and stop the Evil M once and for all, with the help of Selenia and Betameche",tt3257582,tt0940657,tt1647446,tt2391821,https://www.youtube.com/embed/v_m4OXrSpUM,https://Trailers.to/player/embed/imdb/tt0940656
270,tt4788934,The Guardian Brothers,Animation,2022,2016.0,103.0,5.5,https://m.media-amazon.com/images/M/MV5BY2VhNDYxYWItOTM4My00ZWQzLThmZjktZTIwNWI4NmJkYzlkL2ltYWdlXkEyXkFqcGdeQXVyMTExNDQ2MTI@.jpg,['China'],"There's a crisis in the Chinese Spirit World -- humans don't believe in gods anymore! A Door God, facing unemployment, ventures into the human world to prove his worth, leading to unexpected encounters and transformations for humans and spirits alike.""]",tt6992642,tt2332523,tt9648078,tt0974662,https://www.youtube.com/embed/LvTw9XJWwWE,https://Trailers.to/player/embed/imdb/tt4788934
271,tt0259929,Un chant de Noël,Animation,1854,2001.0,81.0,5.5,https://m.media-amazon.com/images/M/MV5BMTgzMDMyNDA0Nl5BMl5BanBnXkFtZTcwMzY0NjEzNA@@.jpg,"['United Kingdom', 'Germany']",Old bitter miser Ebenezer Scrooge (Simon Callow) who makes excuses for his uncaring nature learns real compassion when three ghosts visit him on Christmas Eve,tt0444629,tt0310790,tt0114349,tt0163080,https://www.youtube.com/embed/HEStW6KkSBg,https://Trailers.to/player/embed/imdb/tt0259929
272,tt3257582,Genesect et l'Éveil de la Légende,Adventure,1299,2013.0,96.0,5.5,https://m.media-amazon.com/images/M/MV5BMzFiMThiNmUtMGYyZS00OGU3LThhYmQtNjI2N2QzNzgzNzI0L2ltYWdlL2ltYWdlXkEyXkFqcGdeQXVyMzM4MjM0Nzg@.jpg,['Japan'],"Ash, Pikachu, and friends must stop Mewtwo and a group of Genesect from the destroying the city.']",tt1647446,tt2288005,tt5746054,tt0940656,https://www.youtube.com/embed/S-8sNPW9aBQ,https://Trailers.to/player/embed/imdb/tt3257582
273,tt5746054,La grande cavale,Adventure,1044,2018.0,92.0,5.5,https://m.media-amazon.com/images/M/MV5BZDVmMDY1ZGItZGNiYS00Y2IxLTk3YTQtYWY4MmE4Mjg4NGEyXkEyXkFqcGdeQXVyMjMwODE4ODI@.jpg,"['Germany', 'Belgium']","Marnie is a chubby cat, treated like a princess and getting everything she wants. When she is forced to make her own way in the world, she realizes who she really is - a lonely cat in need of friends",tt2288005,tt9204164,tt3257582,tt4937208,https://www.youtube.com/embed/NjOPH7W8XnI,https://Trailers.to/player/embed/imdb/tt5746054
274,tt5848640,Amir et Mina: les aventures du tapis volant,Animation,397,2018.0,81.0,5.5,https://m.media-amazon.com/images/M/MV5BZDlmNmE5NDAtYTIzZi00ZGE3LWIzNmItMmNmYTM0NjVhYTNjXkEyXkFqcGdeQXVyNjk4MzY1MTk@.jpg,['Denmark'],"Hodja is a boy from Pjort, who borrows a flying carpet to see the world. In return he has to find and return ""diamond"" to her grandfather. The all-eating Sultan wants to get his hands on Hodjas flying carpet.']",tt4764566,tt2534642,tt3921852,tt2476096,https://www.youtube.com/embed/lYEl0dHf4pw,https://Trailers.to/player/embed/imdb/tt5848640
275,tt2091947,Pettson & Picpus,Animation,353,2014.0,86.0,5.5,https://m.media-amazon.com/images/M/MV5BZThiMmMyNWQtZWJhYi00MmRiLThkMjMtYzgzMjk4OTc5NzhiXkEyXkFqcGdeQXVyMjg0OTA3Mg@@.jpg,['Germany'],The adventures of a grumpy old farmer and his cat,tt1961324,tt2396690,tt3746824,tt1757912,,https://Trailers.to/player/embed/imdb/tt2091947
276,tt0114349,Le monde est un grand chelm,Animation,161,1995.0,79.0,5.5,https://m.media-amazon.com/images/M/MV5BMTQ3MjMwMzM1OF5BMl5BanBnXkFtZTcwMjU5MzQyMQ@@.jpg,"['France', 'Germany', 'Hungary']","When God distributed wiseness and foolishness through a newly created world, one of the cherubs accidentally dropped all the foolishness on a tiny village called Chelm. So everyone in the village is very dumb. Recently orphaned boy Aaron and his friendly goat Zlateh live there with Aaron's uncle Shlemiel. When an evil sorcerer and his monster attack the village, Aaron and Zlateh have to defend it themselves.::Anonymous""]",tt0259929,tt0099878,tt0258050,tt0163080,https://www.youtube.com/embed/5mlLve4nebo,https://Trailers.to/player/embed/imdb/tt0114349
277,tt0444629,Felix - Autour du Monde,Animation,103,2005.0,81.0,5.5,https://m.media-amazon.com/images/M/MV5BMTczMzEwOTQwNV5BMl5BanBnXkFtZTgwMDMxNDE2ODE@.jpg,['Germany'],"After being separated from his friend Sophie, Felix embarks on a journey filled with mystical creatures in this high quality animated feature for your kids and family",tt0259929,tt0402438,tt0310790,tt1764666,,https://Trailers.to/player/embed/imdb/tt0444629
278,tt2243621,The Snow Queen - La Reine des Neiges,Adventure,2525,2012.0,80.0,5.4,https://m.media-amazon.com/images/M/MV5BY2JhOTRlMTYtMDhhOC00OTZkLTg5ZmEtNWQxNmYzZjMyZTViXkEyXkFqcGdeQXVyMjE5NjEyMjM@.jpg,"['Russia', 'India', 'United States', 'Portugal', 'Brazil', 'Iran']","The Snow Queen created the world of eternal winter where the polar wind cools human souls and clearness of lines obscure emotions. A girl named Gerda, her pet ferret Luta, and Orm the troll must save her brother Kai and the world.']",tt3823912,tt1507564,tt1180335,tt2296935,https://www.youtube.com/embed/HF_oaTD1rXg,https://Trailers.to/player/embed/imdb/tt2243621
279,tt2766104,L'envol de Ploé,Adventure,1092,2018.0,83.0,5.4,https://m.media-amazon.com/images/M/MV5BMThhYjc1Y2YtZTM5MC00MjU3LWE1NTctMjM4YjNiNjFmNTczXkEyXkFqcGdeQXVyMjMwODE4ODI@.jpg,"['Iceland', 'Belgium']","A plover chick has not learned to fly when his family migrates in the fall. He must survive the arctic winter, vicious enemies and himself in order to be reunited with his beloved one next spring.']",tt8524650,tt7139246,tt3823912,tt2243621,https://www.youtube.com/embed/42GfRs9er68,https://Trailers.to/player/embed/imdb/tt2766104
280,tt0116728,Jungle Jack 2: La star de la jungle,Animation,749,1996.0,72.0,5.4,https://m.media-amazon.com/images/M/MV5BMTQ0MjkyNjg3Ml5BMl5BanBnXkFtZTcwNTQ4NDAzMQ@@.jpg,"['Denmark', 'Sweden', 'Norway', 'Finland']","Hugo, the one-of-a-kind jungle animal, is snatched away from his home for a second time in another attempt for him to become an animal actor. Meanwhile, he's reunited with Rita the kind, streetwise fox. Finding that life in front of and behind the camera isn't so bad, he grows more unaccustomed to wild life once he escapes and slowly weakens his relationship with Rita.::jcsmarchesi""]",tt0120733,tt0215479,tt0206367,tt0400771,,https://Trailers.to/player/embed/imdb/tt0116728
281,tt0400771,Les trois rois mages,Animation,359,2003.0,76.0,5.4,https://m.media-amazon.com/images/M/MV5BMTkxMDIyNjkyNl5BMl5BanBnXkFtZTcwODc2NjgzMQ@@.jpg,"['France', 'Spain', 'United Kingdom', 'Ireland']",The story of Jesus' birth and the journey of the 3 wise men who brought him gifts.,tt0402438,tt0120733,tt0206367,tt1086797,,https://Trailers.to/player/embed/imdb/tt0400771
282,tt0940657,Arthur et la vengeance de Maltazard,Adventure,9151,2009.0,107.0,5.3,https://m.media-amazon.com/images/M/MV5BNjc3Y2FiZWUtMDFlYi00NjBhLTgyYTUtODZjZjU0ZjM5YWMyXkEyXkFqcGdeQXVyNDgyODgxNjE@.jpg,['France'],"Arthur answers a distress call from Princess Selenia, who is menaced by the nefarious Maltazard",tt2391821,tt0940656,tt3257582,tt9896916,https://www.youtube.com/embed/idh1KNSpH3I,https://Trailers.to/player/embed/imdb/tt0940657
283,tt8524650,Monsters Academy,Adventure,947,2020.0,85.0,5.3,https://m.media-amazon.com/images/M/MV5BZGQyMTdkNzctOGYwMS00ZmQxLTg0ODItNzM1MmIzYzlmNmRhXkEyXkFqcGdeQXVyMjgzNjA3Mw@@.jpg,"['Mexico', 'United Kingdom', 'Canada']",An intelligent 15-year-old high school student is unexpectedly transferred to a boarding school where he opens a portal of monsters from another dimension.'],tt7139246,tt2766104,tt11992904,tt7063304,https://www.youtube.com/embed/C00bzB8GGyE,https://Trailers.to/player/embed/imdb/tt8524650
284,tt0310790,La forêt enchantée,Animation,594,2001.0,83.0,5.3,https://m.media-amazon.com/images/M/MV5BMTQzNTI5NTI1OV5BMl5BanBnXkFtZTcwODQ4MTg0MQ@@.jpg,['Spain'],"Except when there's people around, the mysterious woods of Cecebre resound with the conversation of the various animals and even the oaks, chestnuts, birches and weeping willows. But men plant what seems a leafless tree, actually a telephone pole, which also sprouts a mouth but speaks like his human makers. A scientist decides to catch one mole, Linda, for his dissertation, but his bossy wife, a 'fashionable' woman, takes it and wants them all to make fur-coats 'now mink is out'; Linda's lover Furi escapes, learns the truth which the trees heard from the telephone wires and sets out to the rescue in the human world, where everything natural is abused...::KGF Vissers""]",N,a,N,,,https://Trailers.to/player/embed/imdb/tt0310790
