,tconst,title,genre1,numVotes,startYear,runtimeMinutes,averageRating,url,pays_prod,synopsis,reco1,reco2,reco3,reco4,trailer_embed_url,complete_movie_embed_url
1160,tt0108330,Blessures secrètes,Biography,51175.0,1993.0,115.0,7.3,https://m.media-amazon.com/images/M/MV5BODA5ZTBjNjktZTc0OS00Yjc5LWJiNzUtYmRhYjVkYTI4MWExL2ltYWdlXkEyXkFqcGdeQXVyNTAyODkwOQ@@.jpg,['United States'],"The story about the relationship between a rebellious 1950s teenager and his abusive stepfather, based on the memoirs of writer and literature Professor Tobias Wolff",tt0108065,tt0110116,tt0108002,tt0106246,https://www.youtube.com/embed/P28qmkCrNSM,https://Trailers.to/player/embed/imdb/tt0108330
1161,tt2870648,Amy,Biography,50684.0,2015.0,128.0,7.8,https://m.media-amazon.com/images/M/MV5BMTQ1MzE4MTE3OF5BMl5BanBnXkFtZTgwOTcyNDM3NTE@.jpg,['United Kingdom'],Archival footage and personal testimonials present an intimate portrait of the life and career of British singer/songwriter Amy Winehouse,tt1596363,tt4846340,tt2980516,tt3169706,https://www.youtube.com/embed/2H78vCyPKp8,https://Trailers.to/player/embed/imdb/tt2870648
1162,tt1286537,"Food, Inc.",Documentary,50643.0,2008.0,94.0,7.8,https://m.media-amazon.com/images/M/MV5BZGNhYTA1ODMtY2M5Yy00MTYwLWFlZmEtNDM4M2I4ZTI2ZmVmXkEyXkFqcGdeQXVyNTA4NzY1MzY@.jpg,['United States'],An unflattering look inside America's corporate controlled food industry.,tt1772925,tt0493459,tt1935156,tt0428803,https://www.youtube.com/embed/IJDGUxqEdYY,https://Trailers.to/player/embed/imdb/tt1286537
1163,tt1069238,Departures,Drama,50589.0,2008.0,130.0,8.1,https://m.media-amazon.com/images/M/MV5BMTUzOTcwOTA2NV5BMl5BanBnXkFtZTcwNDczMzczMg@@.jpg,['Japan'],A newly unemployed cellist takes a job preparing the dead for funerals,tt1305806,tt1639426,tt1010048,tt0405159,https://www.youtube.com/embed/RXTP_wRSHQw,https://Trailers.to/player/embed/imdb/tt1069238
1164,tt0172684,Laisse parler ton coeur,Comedy,50578.0,1998.0,177.0,7.6,https://m.media-amazon.com/images/M/MV5BNGNhNWMwNTgtZmNlOS00OGM3LWIxYzItOWQwZDJjMzQ3MzRlXkEyXkFqcGdeQXVyODE5NzE3OTE@.jpg,['India'],"During their college years, Anjali was in love with her best-friend Rahul, but he had eyes only for Tina. Years later, Rahul and the now-deceased Tina's eight-year-old daughter attempts to reunite her father and Anjali.",tt0108122,tt0347304,tt0292490,tt0114787,https://www.youtube.com/embed/IxnUHB64NcU,https://Trailers.to/player/embed/imdb/tt0172684
1165,tt1093370,Jab We Met,Comedy,50491.0,2007.0,138.0,7.9,https://m.media-amazon.com/images/M/MV5BYmIzYmY4MGItM2I4YS00OWZhLWFmMzQtYzI2MWY1MmM3NGU1XkEyXkFqcGdeQXVyNjQ2MjQ5NzM@.jpg,['India'],A depressed wealthy businessman finds his life changing after he meets a spunky and care-free young woman,tt0401085,tt0456144,tt2181931,tt0293715,https://www.youtube.com/embed/VoaKuOjez9k,https://Trailers.to/player/embed/imdb/tt1093370
1166,tt1360860,À propos d'Elly,Drama,50448.0,2009.0,119.0,8.0,https://m.media-amazon.com/images/M/MV5BMTQ0MzQxODQ0MV5BMl5BanBnXkFtZTgwNTQ0NzY4NDE@.jpg,"['Iran', 'France']",The mysterious disappearance of a kindergarten teacher during a picnic in the north of Iran is followed by a series of misadventures for her fellow travelers,tt1010048,tt1205489,tt1032846,tt0947798,https://www.youtube.com/embed/atb0JaAN_90,https://Trailers.to/player/embed/imdb/tt1360860
1167,tt4005402,Colonia,Biography,50418.0,2015.0,110.0,7.1,https://m.media-amazon.com/images/M/MV5BMjE3NjQ1MTIxNl5BMl5BanBnXkFtZTgwOTY4OTIzODE@.jpg,"['Germany', 'France', 'Luxembourg', 'United Kingdom', 'United States']","A young woman's desperate search for her abducted boyfriend draws her into the infamous Colonia Dignidad, a sect nobody has ever escaped from.",tt4257926,tt2005151,tt6133130,tt0787524,https://www.youtube.com/embed/SiVAGDTmlpY,https://Trailers.to/player/embed/imdb/tt4005402
1168,tt4595882,Les faussaires de Manhattan,Biography,50000.0,2018.0,106.0,7.1,https://m.media-amazon.com/images/M/MV5BMTFkZmFmNzEtM2FjZC00MmQ1LThlMjctODc1M2RmNzE5NjFjXkEyXkFqcGdeQXVyODY1NDk1NjE@.jpg,['United States'],"When Lee Israel falls out of step with current tastes, she turns her art form to deception",tt1653665,tt6133130,tt8206668,tt6513120,https://www.youtube.com/embed/O6jctuFCLsE,https://Trailers.to/player/embed/imdb/tt4595882
1169,tt6908274,Mirage,Drama,49957.0,2018.0,128.0,7.4,https://m.media-amazon.com/images/M/MV5BZWRhNGRhMTUtOTMwYS00YzE2LTk2YWQtMDU2MGQyYWNmMmU4XkEyXkFqcGdeQXVyMzY0MTE3NzU@.jpg,['Spain'],Two storms separated by 25 years. A woman murdered. A daughter missed. Only 72 hours to discover the truth,tt1289403,tt7784604,tt2396589,tt6398184,https://www.youtube.com/embed/3NCOwTBWYdE,https://Trailers.to/player/embed/imdb/tt6908274
1170,tt2758880,Sommeil d'hiver,Drama,49753.0,2014.0,196.0,8.1,https://m.media-amazon.com/images/M/MV5BYzE2MjEwMTQtOTQ2Mi00ZWExLTkyMjUtNmJjMjBlYWFjZDdlXkEyXkFqcGdeQXVyMTI3ODAyMzE2.jpg,"['Turkey', 'France', 'Germany']",A hotel owner and landlord in a remote Turkish village deals with conflicts within his family and a tenant behind on his rent,tt6628102,tt3461252,tt2278871,tt1065073,https://www.youtube.com/embed/IMN4KX6BIpY,https://Trailers.to/player/embed/imdb/tt2758880
1171,tt0305206,American Splendor,Biography,49058.0,2003.0,101.0,7.4,https://m.media-amazon.com/images/M/MV5BMjA0MjYxNjY1MV5BMl5BanBnXkFtZTcwNDkwMjAwMQ@@.jpg,['United States'],An original mix of fiction and reality illuminates the life of comic book hero everyman Harvey Pekar,tt0252444,tt0433383,tt0340855,tt0436697,https://www.youtube.com/embed/HerH_v1Bw14,https://Trailers.to/player/embed/imdb/tt0305206
1172,tt0460989,Le vent se lève,Drama,48981.0,2006.0,127.0,7.5,https://m.media-amazon.com/images/M/MV5BYTE0ZGE4YTItZTE2NC00MzZjLTkyMWUtMTZiODAwNTRlNDk4XkEyXkFqcGdeQXVyMTQxNzMzNDI@.jpg,"['Ireland', 'United Kingdom', 'Germany', 'Italy', 'Spain', 'France', 'Belgium', 'Switzerland', 'Netherlands']","Against the backdrop of the Irish War of Independence, two brothers fight a guerrilla war against British forces",tt0446755,tt0408777,tt1068646,tt0419887,https://www.youtube.com/embed/xhn5_gUcO5E,https://Trailers.to/player/embed/imdb/tt0460989
1173,tt0104684,À toute épreuve,Action,48895.0,1992.0,128.0,7.8,https://m.media-amazon.com/images/M/MV5BOTIzZGU4ZWMtYmNjMy00NzU0LTljMGYtZmVkMDYwN2U2MzYwL2ltYWdlXkEyXkFqcGdeQXVyNTAyODkwOQ@@.jpg,['Hong Kong'],A tough-as-nails cop teams up with an undercover agent to shut down a sinister mobster and his crew,tt0108358,tt0106977,tt0112864,tt0119174,https://www.youtube.com/embed/jAtxZHuJNW4,https://Trailers.to/player/embed/imdb/tt0104684
1174,tt1313104,The cove - La baie de la honte,Biography,48887.0,2009.0,92.0,8.4,https://m.media-amazon.com/images/M/MV5BMzM3NTRhMTctNTE2MS00YjJmLWE2ZmMtMmY3MWI0ODExMTMzXkEyXkFqcGdeQXVyNTA4NzY1MzY@.jpg,['United States'],"Using state-of-the-art equipment, a group of activists, led by renowned dolphin trainer Ric O'Barry, infiltrate a cove near Taijii, Japan to expose both a shocking instance of animal abuse and a serious threat to human health.",tt1152758,tt1424432,tt2125608,tt1028532,https://www.youtube.com/embed/4KRD8e20fBo,https://Trailers.to/player/embed/imdb/tt1313104
1175,tt0363226,Zatoichi,Action,48702.0,2003.0,116.0,7.5,https://m.media-amazon.com/images/M/MV5BOTQ2MzNmZDYtZDExNi00MDA2LWFkNjYtY2I4N2E4NzkzOTEwXkEyXkFqcGdeQXVyMTMxODk2OTU@.jpg,['Japan'],"The blind masseur/swordsman comes to a town in control of warring gangs, and while bunking with a farming family, he meets two women with their own agenda",tt0385004,tt0369339,tt0456912,tt0399295,https://www.youtube.com/embed/ZuqwMQTc8cE,https://Trailers.to/player/embed/imdb/tt0363226
1176,tt0109045,"Priscilla, folle du désert",Comedy,48643.0,1994.0,104.0,7.5,https://m.media-amazon.com/images/M/MV5BMTc5MDU1NzcyN15BMl5BanBnXkFtZTcwMDA0ODYyNA@@.jpg,['Australia'],Two drag performers and a transgender woman travel across the desert to perform their unique style of cabaret,tt0103873,tt0106677,tt0104466,tt0109348,https://www.youtube.com/embed/Jtz7jaBpSKk,https://Trailers.to/player/embed/imdb/tt0109045
1177,tt0418455,Les pommes d'Adam,Comedy,48594.0,2005.0,94.0,7.8,https://m.media-amazon.com/images/M/MV5BMTU4NTc5NjM5M15BMl5BanBnXkFtZTgwODEyMTE0MDE@.jpg,"['Denmark', 'Germany']",A neo-Nazi sentenced to community service at a church clashes with the blindly devoted minister,tt0372824,tt0449059,tt0365748,tt0311519,,https://Trailers.to/player/embed/imdb/tt0418455
1178,tt0362269,Dr. Kinsey,Biography,48544.0,2004.0,118.0,7.1,https://m.media-amazon.com/images/M/MV5BMTA0MjA1MjA4MDNeQTJeQWpwZ15BbWU3MDQxMDQ2MjE@.jpg,"['Germany', 'United States']","A look at the life of Alfred Kinsey, a pioneer in the area of human sexuality research, whose 1948 publication ""Sexual Behavior in the Human Male"" was one of the first recorded works that saw science address sexual behavior",tt0385726,tt0355702,tt0379725,tt0274309,https://www.youtube.com/embed/5UxVz4tn7ZA,https://Trailers.to/player/embed/imdb/tt0362269
1179,tt7838252,K.G.F: Chapter 1,Action,48464.0,2018.0,156.0,8.3,https://m.media-amazon.com/images/M/MV5BZDNlNzBjMGUtYTA0Yy00OTI2LWJmZjMtODliYmUyYTI0OGFmXkEyXkFqcGdeQXVyODIwMDI1NjM@.jpg,['India'],"In the 1970s, a fierce rebel rises against brutal oppression and becomes the symbol of hope to legions of downtrodden people",tt4154756,tt6148156,tt5074352,tt1950186,https://www.youtube.com/embed/qXgF-iJ_ezE,https://Trailers.to/player/embed/imdb/tt7838252
1180,tt1613750,Kon-Tiki,Adventure,47826.0,2012.0,118.0,7.2,https://m.media-amazon.com/images/M/MV5BMjMxOTU2NzQxMF5BMl5BanBnXkFtZTcwODIwODY0OA@@.jpg,"['United Kingdom', 'Norway', 'Denmark', 'Germany', 'Sweden']","Legendary explorer Thor Heyerdahl's epic 4,300-mile crossing of the Pacific on a balsawood raft in 1947, in an effort to prove that it was possible for South Americans to settle in Polynesia in pre-Columbian times.",tt2167266,tt1204342,tt0359950,tt2113681,https://www.youtube.com/embed/e4DZ7svBw7I,https://Trailers.to/player/embed/imdb/tt1613750
1181,tt1190536,Black Dynamite,Action,47723.0,2009.0,84.0,7.4,https://m.media-amazon.com/images/M/MV5BODMyM2JiYzMtODY3OS00ODExLTg0YzYtYWNlZTczMDUzY2I3XkEyXkFqcGdeQXVyNTA4NzY1MzY@.jpg,['United States'],"Black Dynamite is the greatest African-American action star of the 1970s. When his only brother is killed by The Man, it's up to him to find justice.",tt0945513,tt1001526,tt1302011,tt0441773,https://www.youtube.com/embed/96Y24a0cyCE,https://Trailers.to/player/embed/imdb/tt1190536
1182,tt2935476,Loin de la foule déchaînée,Drama,47707.0,2015.0,119.0,7.1,https://m.media-amazon.com/images/M/MV5BNzI4NzUwNDgwN15BMl5BanBnXkFtZTgwNTI3MjMwNTE@.jpg,"['United Kingdom', 'United States']","In Victorian England, the independent and headstrong Bathsheba Everdene attracts three very different suitors: Gabriel Oak, a sheep farmer; Frank Troy, a reckless Sergeant; and William Boldwood, a prosperous and mature bachelor",tt2582502,tt2726560,tt2402927,tt2891174,https://www.youtube.com/embed/T9ZiQ8Z2wBY,https://Trailers.to/player/embed/imdb/tt2935476
1183,tt1416801,Bulletproof Gangster,Biography,47586.0,2011.0,106.0,7.1,https://m.media-amazon.com/images/M/MV5BMTQyNzIxMzMwMV5BMl5BanBnXkFtZTcwOTU4OTcxNA@@.jpg,['United States'],"The true story of Danny Greene, a tough Irish thug working for mobsters in Cleveland during the 1970's.",tt1270262,tt1244754,tt0896872,tt1266029,https://www.youtube.com/embed/x2zN53Vwnz0,https://Trailers.to/player/embed/imdb/tt1416801
1184,tt2404461,Le Passé,Drama,47553.0,2013.0,130.0,7.7,https://m.media-amazon.com/images/M/MV5BOTEwNDM1ODEwN15BMl5BanBnXkFtZTcwMzM0NDg0OQ@@.jpg,"['France', 'Italy', 'Belgium', 'Iran']","An Iranian man deserts his French wife and her two children to return to his homeland. Meanwhile, his wife starts up a new relationship, a reality her husband confronts upon his wife's request for a divorce.",tt2582846,tt2213054,tt3076658,tt1365050,https://www.youtube.com/embed/Z2-_lt4kwXE,https://Trailers.to/player/embed/imdb/tt2404461
1185,tt0169858,Neon Genesis Evangelion: The End of Evangelion,Action,47535.0,1997.0,87.0,8.1,https://m.media-amazon.com/images/M/MV5BMDAxYzU2YjEtNmNjNS00OGJlLTg3MzgtNzAwN2E1ZWFiYTg5XkEyXkFqcGdeQXVyNTkwNzYyODM@.jpg,['Japan'],Concurrent theatrical ending of the TV series Shin seiki evangerion (1995),tt0129167,tt0113568,tt0119472,tt0107692,https://www.youtube.com/embed/XIBRfn2D7ZU,https://Trailers.to/player/embed/imdb/tt0169858
1186,tt0119256,Hard Eight,Crime,47493.0,1996.0,102.0,7.2,https://m.media-amazon.com/images/M/MV5BMTY2ZWQ3NTctMjJiNy00Y2RlLWEyM2MtNTBmNjAxMWJhZTFmXkEyXkFqcGdeQXVyNTE1NjY5Mg@@.jpg,['United States'],Professional gambler Sydney teaches John the tricks of the trade. John does well until he falls for cocktail waitress Clementine,tt0115736,tt0110308,tt0117407,tt0103759,https://www.youtube.com/embed/rggtzgTDx1Q,https://Trailers.to/player/embed/imdb/tt0119256
1187,tt3808342,Le fils de Saul,Drama,47286.0,2015.0,107.0,7.5,https://m.media-amazon.com/images/M/MV5BMjFmMzJlMTYtYmRlNy00Zjg5LThmYmYtYmE0NDk3N2MzMjRhXkEyXkFqcGdeQXVyMjc3MTAwNjg@.jpg,['Hungary'],A Jewish-Hungarian concentration camp prisoner sets out to give a child he mistook for his son a proper burial,tt1810683,tt2884206,tt2674426,tt3316960,https://www.youtube.com/embed/GCAvWMtTI5U,https://Trailers.to/player/embed/imdb/tt3808342
1188,tt2737050,"Deux jours, une nuit",Drama,47081.0,2014.0,95.0,7.3,https://m.media-amazon.com/images/M/MV5BMjIyMzczMDI0NF5BMl5BanBnXkFtZTgwNjI5Nzk3MTE@.jpg,"['Belgium', 'France', 'Italy']","Liège, Belgium. Sandra is a factory worker who discovers that her workmates have opted for a EUR1,000 bonus in exchange for her dismissal. She has only a weekend to convince her colleagues to give up their bonuses in order to keep her job",tt1198156,tt2866360,tt2234003,tt1772250,https://www.youtube.com/embed/t27VrhtEGDE,https://Trailers.to/player/embed/imdb/tt2737050
1189,tt0293715,Yeopgijeogin geunyeo,Comedy,46982.0,2001.0,137.0,8.0,https://m.media-amazon.com/images/M/MV5BMjM2NTYxMTE3OV5BMl5BanBnXkFtZTgwNDgwNjgwMzE@.jpg,['South Korea'],"A young man sees a drunk, cute woman standing too close to the tracks at a metro station in Seoul and pulls her back. She ends up getting him into trouble repeatedly after that, starting on the train",tt0117589,tt0118843,tt0401085,tt0456144,https://www.youtube.com/embed/xL-CQ8ILtQw,https://Trailers.to/player/embed/imdb/tt0293715
1190,tt0106364,Batman contre le fantôme masqué,Action,46950.0,1993.0,76.0,7.8,https://m.media-amazon.com/images/M/MV5BYTRiMWM3MGItNjAxZC00M2E3LThhODgtM2QwOGNmZGU4OWZhXkEyXkFqcGdeQXVyNjExODE1MDc@.jpg,['United States'],Batman is wrongly implicated in a series of murders of mob bosses actually done by a new vigilante assassin,tt0113568,tt0119472,tt0107692,tt0129167,https://www.youtube.com/embed/G__jUFD4Ef8,https://Trailers.to/player/embed/imdb/tt0106364
1191,tt6398184,Downton Abbey,Drama,46927.0,2019.0,122.0,7.4,https://m.media-amazon.com/images/M/MV5BMmQxNGRkMjYtZTAyMy00MDUyLThiNmYtODI1NTkyNmI0ZTNlXkEyXkFqcGdeQXVyMjM4NTM5NDY@.jpg,"['United Kingdom', 'United States']","The continuing story of the Crawley family, wealthy owners of a large estate in the English countryside in the early twentieth century.']",tt1289403,tt6908274,tt7784604,tt8291806,https://www.youtube.com/embed/tu3mP0c51hE,https://Trailers.to/player/embed/imdb/tt6398184
1192,tt0107616,Beaucoup de bruit pour rien,Comedy,46827.0,1993.0,111.0,7.3,https://m.media-amazon.com/images/M/MV5BY2Q3YTU4OTgtZTc0My00YmY1LWJmOTQtMmMwNGE2ZjBmNmIxXkEyXkFqcGdeQXVyMTAwMzUyOTc@.jpg,"['United Kingdom', 'United States']","Young lovers Hero and Claudio, soon to wed, conspire to get verbal sparring partners and confirmed singles Benedick and Beatrice to wed as well",tt0109686,tt0110074,tt0107507,tt0110598,https://www.youtube.com/embed/wGlmhwa0zjw,https://Trailers.to/player/embed/imdb/tt0107616
1193,tt0331811,Onze heures quatorze,Comedy,46770.0,2003.0,86.0,7.2,https://m.media-amazon.com/images/M/MV5BMGM2MzVlMTMtNzVjNC00MTFiLTkzZDctZjMwMTJlNjJkYWZhXkEyXkFqcGdeQXVyNDkzNTM2ODg@.jpg,"['United States', 'Canada']","The events leading up to an 11:14 p.m. car crash, from five very different perspectives",tt0310281,tt0310203,tt0302886,tt0357413,https://www.youtube.com/embed/XS8gh5qMlFw,https://Trailers.to/player/embed/imdb/tt0331811
1194,tt1966604,The Imposter,Biography,46762.0,2012.0,99.0,7.5,https://m.media-amazon.com/images/M/MV5BN2RkOGI3NjAtMzllOC00MGQ3LWI4NDEtNTI4NGM0Nzg2ZGFkXkEyXkFqcGdeQXVyMTQxNzMzNDI@.jpg,"['United Kingdom', 'United States']",A documentary centered on a young man in Spain who claims to a grieving Texas family that he is their 16-year-old son who has been missing for 3 years,tt2431286,tt1542344,tt1559549,tt1226271,https://www.youtube.com/embed/opuE9CivBgg,https://Trailers.to/player/embed/imdb/tt1966604
1195,tt4048272,Toni Erdmann,Comedy,46707.0,2016.0,162.0,7.4,https://m.media-amazon.com/images/M/MV5BYzA4OGQ5NmMtNzM1ZC00YzIxLThmZWQtODkyYTA0ZGI3MGIzXkEyXkFqcGdeQXVyMjQwNjczOTE@.jpg,"['Germany', 'Austria', 'Monaco', 'Romania', 'France', 'Switzerland']",A practical joking father tries to reconnect with his hard working daughter by creating an outrageous alter ego and posing as her CEO's life coach.,tt7131622,tt4995790,tt3148502,tt1440232,https://www.youtube.com/embed/j0uwi5EPnpA,https://Trailers.to/player/embed/imdb/tt4048272
1196,tt2396589,Mudbound,Drama,46431.0,2017.0,134.0,7.4,https://m.media-amazon.com/images/M/MV5BZTg3YTEzNjYtZTY2NS00YjNmLTlhNjUtZTI2M2E5NDI4M2NjXkEyXkFqcGdeQXVyMzI3MDEzMzM@.jpg,['United States'],"Two men return home from World War II to work on a farm in rural Mississippi, where they struggle to deal with racism and adjusting to life after war",tt3300980,tt6908274,tt4540710,tt5776858,https://www.youtube.com/embed/vAZWhFI9lLQ,https://Trailers.to/player/embed/imdb/tt2396589
1197,tt4190530,Opération Anthropoid,Action,46382.0,2016.0,120.0,7.2,https://m.media-amazon.com/images/M/MV5BMjIxNzE0NjY1Nl5BMl5BanBnXkFtZTgwNjYzOTkxOTE@.jpg,"['Czechia', 'United Kingdom', 'United States', 'France']","Based on the extraordinary true story of Operation Anthropoid, the WWII mission to assassinate SS General Reinhard Heydrich, the main architect behind the Final Solution and the Reich's third in command after Hitler and Himmler.",tt3532216,tt3967856,tt2719848,tt2675914,https://www.youtube.com/embed/LcbbsZVjiiA,https://Trailers.to/player/embed/imdb/tt4190530
1198,tt7125860,Si Beale Street pouvait parler,Drama,46371.0,2018.0,119.0,7.1,https://m.media-amazon.com/images/M/MV5BZWVkMzY5NzgtMTdlNS00NjY5LThjOTktZWFkNDU3NmQzMDIwXkEyXkFqcGdeQXVyODk2NDQ3MTA@.jpg,['United States'],A young woman embraces her pregnancy while she and her family set out to prove her childhood friend and lover innocent of a crime he didn't commit.,tt6053438,tt2763304,tt6294822,tt6472976,https://www.youtube.com/embed/hGCvdlaWUF0,https://Trailers.to/player/embed/imdb/tt7125860
1199,tt0283509,No Man's Land,Comedy,46173.0,2001.0,98.0,7.9,https://m.media-amazon.com/images/M/MV5BMGFkNjNmZWMtNDdiOS00ZWM3LWE1ZTMtZDU3MGQyMzIyNzZhXkEyXkFqcGdeQXVyMTMxODk2OTU@.jpg,"['France', 'Bosnia & Herzegovina', 'Italy', 'Belgium', 'United Kingdom', 'Slovenia']","Bosnia and Herzegovina during 1993 at the time of the heaviest fighting between the two warring sides. Two soldiers from opposing sides in the conflict, Nino and Ciki, become trapped in no man's land, whilst a third soldier becomes a living booby trap.",tt0372824,tt0365748,tt0248845,tt0311519,https://www.youtube.com/embed/Ypsnv50Af_I,https://Trailers.to/player/embed/imdb/tt0283509
1200,tt1276419,Royal Affair,Biography,46151.0,2012.0,137.0,7.5,https://m.media-amazon.com/images/M/MV5BMTg3MDE4MTQ4NF5BMl5BanBnXkFtZTcwNDgwNDYyOA@@.jpg,"['Denmark', 'Sweden', 'Czechia', 'Germany']","A young queen, who is married to an insane king, falls secretly in love with her physician - and together they start a revolution that changes a nation forever",tt1210166,tt0453562,tt1020072,tt2140373,https://www.youtube.com/embed/e8762G2Toeg,https://Trailers.to/player/embed/imdb/tt1276419
1201,tt0416044,Mongol,Action,45830.0,2007.0,126.0,7.2,https://m.media-amazon.com/images/M/MV5BODlhNTk4ODYtOThlMy00N2E1LThkZDktZjZlMjE1YjM3YTgwL2ltYWdlXkEyXkFqcGdeQXVyNTAyODkwOQ@@.jpg,"['Russia', 'Germany', 'Kazakhstan']",The story recounts the early life of Genghis Khan who was a slave before going on to conquer half the world in 1206,tt0822854,tt0337978,tt1216487,tt0453467,https://www.youtube.com/embed/Hr_PNoCZXg4,https://Trailers.to/player/embed/imdb/tt0416044
1202,tt6333060,Icare,Documentary,45686.0,2017.0,120.0,7.9,https://m.media-amazon.com/images/M/MV5BY2QyZWZjY2UtMTJjZS00YmFlLWJmM2QtZTczODc5MTFkYjQyXkEyXkFqcGdeQXVyNTAyODkwOQ@@.jpg,['United States'],"When Bryan sets out to uncover the truth about doping in sports, a chance meeting with a Russian scientist transforms his story from a personal experiment into a geopolitical thriller",tt4257858,tt7214762,tt0386032,tt5929776,https://www.youtube.com/embed/qXoRdSTrR-4,https://Trailers.to/player/embed/imdb/tt6333060
1203,tt0275277,"Cowboy Bebop, le film",Action,45592.0,2001.0,115.0,7.9,https://m.media-amazon.com/images/M/MV5BMjYzYWM4YTItZjJiMC00OTM5LTg3NDgtOGQ2Njk2ZWNhN2QwXkEyXkFqcGdeQXVyMzM4MjM0Nzg@.jpg,"['Japan', 'United States']","A terrorist explosion releases a deadly virus on the masses, and it's up the bounty-hunting Bebop crew to catch the cold-blooded culprit.",tt0258463,tt0299977,tt0190332,tt0260991,https://www.youtube.com/embed/DX9rKumF5Ao,https://Trailers.to/player/embed/imdb/tt0275277
1204,tt0297884,Loin du paradis,Drama,45572.0,2002.0,107.0,7.4,https://m.media-amazon.com/images/M/MV5BMTE5ODI3MTM4OV5BMl5BanBnXkFtZTYwNjE5OTg2.jpg,"['United States', 'France']","In 1950s Connecticut, a flustered housewife faces a marital crisis and mounting racial tensions in the outside world",tt0256009,tt0274558,tt0314412,tt0217869,https://www.youtube.com/embed/c3CX2gHA3qs,https://Trailers.to/player/embed/imdb/tt0297884
1205,tt0892255,Che - 1ère partie - L'Argentin,Biography,45482.0,2008.0,134.0,7.2,https://m.media-amazon.com/images/M/MV5BM2JiNjE4YjItNTFhNS00ZmYyLWEwNzctNzJmYzNiYWYzOGM3XkEyXkFqcGdeQXVyNTAyODkwOQ@@.jpg,"['France', 'Spain', 'Mexico']","In 1956, Ernesto 'Che' Guevara and a band of Castro-led Cuban exiles mobilize an army to topple the regime of dictator Fulgencio Batista.",tt1057500,tt0393162,tt1028576,tt1327773,https://www.youtube.com/embed/fqTw2dtVQzw,https://Trailers.to/player/embed/imdb/tt0892255
1206,tt0456144,Lage Raho Munna Bhai,Comedy,45461.0,2006.0,144.0,8.1,https://m.media-amazon.com/images/M/MV5BN2ZmMDMwODgtMzA5MS00MGU0LWEyYTgtYzQ5MmQzMzU2NTVkXkEyXkFqcGdeQXVyODE5NzE3OTE@.jpg,['India'],Munna Bhai embarks on a journey with Mahatma Gandhi in order to fight against a corrupt property dealer,tt1093370,tt0293715,tt1562872,tt0401085,https://www.youtube.com/embed/OE6f1oHgeDg,https://Trailers.to/player/embed/imdb/tt0456144
1207,tt9052870,Chhichhore,Comedy,45132.0,2019.0,143.0,8.3,https://m.media-amazon.com/images/M/MV5BYjg2ZDI2YTYtN2EwYi00YWI5LTgyMWQtMWFkYmE3NmJkOGVhXkEyXkFqcGdeQXVyODE5NzE3OTE@.jpg,['India'],"A tragic incident forces Anirudh, a middle-aged man, to take a trip down memory lane and reminisce his college days along with his friends, who were labelled as losers",tt6751668,tt2338151,tt7218518,tt7653254,,https://Trailers.to/player/embed/imdb/tt9052870
1208,tt2567712,Les Poings contre les murs,Crime,45091.0,2013.0,106.0,7.4,https://m.media-amazon.com/images/M/MV5BMTczOTY4MTg2OF5BMl5BanBnXkFtZTgwNTM2NzcxMjE@.jpg,['United Kingdom'],"Eric Love, 19, is locked up in prison. On his first day, he assaults another inmate and several guards. He's offered group therapy and his dad, an inmate as well, tries to talk sense into him. Can he be rehabilitated?",tt3042408,tt1212450,tt4846232,tt1313092,https://www.youtube.com/embed/zE4ziBfu0JA,https://Trailers.to/player/embed/imdb/tt2567712
1209,tt0762073,"Thirst, ceci est mon sang...",Drama,44987.0,2009.0,134.0,7.1,https://m.media-amazon.com/images/M/MV5BYzA4MGVkNjMtYWI5NC00YTQwLWJkZTUtOTdjYmI5OGE4ZTUwL2ltYWdlXkEyXkFqcGdeQXVyNTAyODkwOQ@@.jpg,"['South Korea', 'United States']","Through a failed medical experiment, a priest is stricken with vampirism and is forced to abandon his ascetic ways",tt1527186,tt0913425,tt0758794,tt1560747,https://www.youtube.com/embed/Pj5xmmQj-lk,https://Trailers.to/player/embed/imdb/tt0762073
1210,tt0424880,Candy,Drama,44809.0,2006.0,108.0,7.2,https://m.media-amazon.com/images/M/MV5BNTgwNzliODYtOWI2Yy00OTFhLWExZjgtNTdjNjMzOTAyN2JmXkEyXkFqcGdeQXVyMTAwMzUyOTc@.jpg,['Australia'],"A poet falls in love with an art student who gravitates to his bohemian lifestyle -- and his love of heroin. Hooked as much on one another as they are on the drug, their relationship alternates between states of oblivion, self-destruction, and despair",tt0468489,tt0376541,tt0424136,tt0366627,https://www.youtube.com/embed/tdo-bnAM3Po,https://Trailers.to/player/embed/imdb/tt0424880
1211,tt0385726,Les Chemins du triomphe,Biography,44777.0,2006.0,118.0,7.2,https://m.media-amazon.com/images/M/MV5BMjA2MDY4OTE1N15BMl5BanBnXkFtZTcwOTI5OTMzMQ@@.jpg,['United States'],"In 1966, Texas Western coach Don Haskins led the first all-black starting line-up for a college basketball team to the NCAA national championship",tt0379725,tt0362269,tt0454776,tt0388980,https://www.youtube.com/embed/uEd69QSBI0s,https://Trailers.to/player/embed/imdb/tt0385726
1212,tt1827487,Il était une fois en Anatolie,Crime,44743.0,2011.0,157.0,7.9,https://m.media-amazon.com/images/M/MV5BMDIwYTU3NDktNmJkOS00NmUyLWI3ZmUtNjViZjU4OTM3OTE3XkEyXkFqcGdeQXVyMTI3ODAyMzE2.jpg,"['Turkey', 'Bosnia & Herzegovina']",A group of men set out in search of a dead body in the Anatolian steppes,tt1568346,tt1235166,tt1132620,tt1392214,https://www.youtube.com/embed/jJOFUsO_N20,https://Trailers.to/player/embed/imdb/tt1827487
