,tconst,title,genre1,numVotes,startYear,runtimeMinutes,averageRating,url,pays_prod,synopsis,reco1,reco2,reco3,reco4,trailer_embed_url,complete_movie_embed_url
419,tt0121164,Les noces funèbres,Animation,258055.0,2005.0,77.0,7.3,https://m.media-amazon.com/images/M/MV5BMTk1MTY1NjU4MF5BMl5BanBnXkFtZTcwNjIzMTEzMw@@.jpg,"['United States', 'United Kingdom']","When a shy groom practices his wedding vows in the inadvertent presence of a deceased young woman, she rises from the grave assuming he has married her",tt0120910,tt0775489,tt1798188,tt0983213,https://www.youtube.com/embed/IA2wo6ap1Wk,https://Trailers.to/player/embed/imdb/tt0121164
420,tt1817273,The Place Beyond the Pines,Crime,257359.0,2012.0,140.0,7.3,https://m.media-amazon.com/images/M/MV5BMjc1OTEwNjU4N15BMl5BanBnXkFtZTcwNzUzNDIwOQ@@.jpg,['United States'],"A motorcycle stunt rider turns to robbing banks as a way to provide for his lover and their newborn child, a decision that puts him on a collision course with an ambitious rookie cop navigating a department ruled by a corrupt detective",tt1800241,tt1872194,tt1343097,tt1821593,https://www.youtube.com/embed/3Gpgzd72P7k,https://Trailers.to/player/embed/imdb/tt1817273
421,tt2277860,Le monde de Dory,Adventure,256564.0,2016.0,97.0,7.3,https://m.media-amazon.com/images/M/MV5BNzg4MjM2NDQ4MV5BMl5BanBnXkFtZTgwMzk3MTgyODE@.jpg,['United States'],"Friendly but forgetful blue tang Dory begins a search for her long-lost parents, and everyone learns a few things about the real meaning of family along the way",tt1109624,tt2262227,tt1753383,tt1690953,https://www.youtube.com/embed/-TY79KJiJMk,https://Trailers.to/player/embed/imdb/tt2277860
422,tt3263904,Sully,Biography,255423.0,2016.0,96.0,7.4,https://m.media-amazon.com/images/M/MV5BY2NmZDAwM2QtZmFiMS00OTJlLTgxMTItZDMyZmVhYjE1MDY3XkEyXkFqcGdeQXVyMTMxODk2OTU@.jpg,['United States'],"The story of Chesley ""Sully"" Sullenberger (Tom Hanks), an American pilot who became a hero after landing his damaged plane on the Hudson River in order to save the flight\'s passengers and crew",tt3606888,tt3521126,tt1083452,tt2404181,https://www.youtube.com/embed/OsINvu5FYKg,https://Trailers.to/player/embed/imdb/tt3263904
423,tt4550098,Nocturnal Animals,Drama,255357.0,2016.0,116.0,7.5,https://m.media-amazon.com/images/M/MV5BMTYwMzMwMzgxNl5BMl5BanBnXkFtZTgwMTA0MTUzMDI@.jpg,['United States'],"A wealthy art gallery owner is haunted by her ex-husband's novel, a violent thriller she interprets as a symbolic revenge tale.",tt2381111,tt5607714,tt4975722,tt5649144,https://www.youtube.com/embed/JOsEU5oYpTA,https://Trailers.to/player/embed/imdb/tt4550098
424,tt4160708,Don't Breathe: La Maison des ténèbres,Crime,254615.0,2016.0,88.0,7.1,https://m.media-amazon.com/images/M/MV5BZGI5ZTU2M2YtZWY4MC00ZDFhLTliYTItZTk1NjdlN2NkMzg2XkEyXkFqcGdeQXVyMjY5ODI4NDk@.jpg,"['United States', 'Hungary']","Hoping to walk away with a massive fortune, a trio of thieves break into the house of a blind man who isn't as helpless as he seems.",tt2359024,tt2438644,tt9412098,tt6768578,https://www.youtube.com/embed/76yBTNDB6vU,https://Trailers.to/player/embed/imdb/tt4160708
425,tt0116695,Jerry Maguire,Comedy,253852.0,1996.0,139.0,7.3,https://m.media-amazon.com/images/M/MV5BYTM0ZWNmZTUtOTVkZS00MTZiLTg3M2QtZjA0Y2RmOWM1NWEyXkEyXkFqcGdeQXVyNjU0OTQ0OTY@.jpg,['United States'],"When a sports agent has a moral epiphany and is fired for expressing it, he decides to put his new philosophy to the test as an independent agent with the only athlete who stays with him and his former colleague",tt0106307,tt0104694,tt0280707,tt0120789,https://www.youtube.com/embed/rCCaTPY-z4Q,https://Trailers.to/player/embed/imdb/tt0116695
426,tt0151804,"35 heures, c'est déjà trop",Comedy,253489.0,1999.0,89.0,7.7,https://m.media-amazon.com/images/M/MV5BOTA5MzQ3MzI1NV5BMl5BanBnXkFtZTgwNTcxNTYxMTE@.jpg,['United States'],Three company workers who hate their jobs decide to rebel against their greedy boss,tt0128445,tt0248845,tt0119038,tt0115640,https://www.youtube.com/embed/3_fG_zLbBeU,https://Trailers.to/player/embed/imdb/tt0151804
427,tt0443272,Lincoln,Biography,253118.0,2012.0,150.0,7.3,https://m.media-amazon.com/images/M/MV5BMTQzNzczMDUyNV5BMl5BanBnXkFtZTcwNjM2ODEzOA@@.jpg,"['United States', 'India']","As the American Civil War continues to rage, America's president struggles with continuing carnage on the battlefield as he fights with many inside his own cabinet on the decision to emancipate the slaves.",tt2304771,tt1276419,tt1057500,tt4209788,https://www.youtube.com/embed/tQNBalJnVx8,https://Trailers.to/player/embed/imdb/tt0443272
428,tt0215750,Stalingrad - Enemy at the Gates,Drama,252541.0,2001.0,131.0,7.6,https://m.media-amazon.com/images/M/MV5BYWFlY2E3ODQtZWNiNi00ZGU4LTkzNWEtZTQ2ZTViMWRhYjIzL2ltYWdlXkEyXkFqcGdeQXVyNTAyODkwOQ@@.jpg,"['Ireland', 'United Kingdom', 'France', 'Germany', 'United States']",A Russian and a German sniper play a game of cat-and-mouse during the Battle of Stalingrad,tt0277027,tt0203009,tt0307901,tt0254686,https://www.youtube.com/embed/xqwlIaOyBSA,https://Trailers.to/player/embed/imdb/tt0215750
429,tt0118749,Boogie Nights,Drama,251732.0,1997.0,155.0,7.9,https://m.media-amazon.com/images/M/MV5BY2E2YWYxY2QtZmJmZi00MjJlLWFiYWItZTk5Y2IyMWQ1ZThhXkEyXkFqcGdeQXVyMTMxODk2OTU@.jpg,['United States'],"Back when sex was safe, pleasure was a business and business was booming, an idealistic porn producer aspires to elevate his craft to an art when he discovers a hot young talent",tt0115751,tt0166924,tt0245712,tt0105323,https://www.youtube.com/embed/YN7pcEa83dU,https://Trailers.to/player/embed/imdb/tt0118749
430,tt3065204,Conjuring 2 : Le Cas Enfield,Horror,251729.0,2016.0,134.0,7.3,https://m.media-amazon.com/images/M/MV5BZjU5OWVlN2EtODNlYy00MjhhLWI0MDUtMTA3MmQ5MGMwYTZmXkEyXkFqcGdeQXVyNjE5MTM4MzY@.jpg,"['Canada', 'United States', 'United Kingdom']",Ed and Lorraine Warren travel to North London to help a single mother raising four children alone in a house plagued by a supernatural spirit,tt1396484,tt4972582,tt5215952,tt1457767,https://www.youtube.com/embed/VFsmuRPClr4,https://Trailers.to/player/embed/imdb/tt3065204
431,tt1192628,Rango,Adventure,250235.0,2011.0,107.0,7.2,https://m.media-amazon.com/images/M/MV5BMTc4NjEyODE1OV5BMl5BanBnXkFtZTcwMjYzNTkxNA@@.jpg,"['United States', 'Canada']","Rango is an ordinary chameleon who accidentally winds up in the town of Dirt, a lawless outpost in the Wild West in desperate need of a new sheriff",tt1453405,tt2167266,tt0481499,tt0359950,https://www.youtube.com/embed/wIKG4s_uSRg,https://Trailers.to/player/embed/imdb/tt1192628
432,tt1931533,7 psychopathes,Comedy,249542.0,2012.0,110.0,7.2,https://m.media-amazon.com/images/M/MV5BMTgwMzUxMjc0M15BMl5BanBnXkFtZTcwMzQ2MjYyOA@@.jpg,"['United Kingdom', 'United States']",A struggling screenwriter inadvertently becomes entangled in the Los Angeles criminal underworld after his oddball friends kidnap a gangster's beloved Shih Tzu.,tt1912398,tt1839492,tt1981677,tt1716777,https://www.youtube.com/embed/jsHR77oQKEY,https://Trailers.to/player/embed/imdb/tt1931533
433,tt0381681,Before Sunset,Drama,249493.0,2004.0,80.0,8.1,https://m.media-amazon.com/images/M/MV5BMTQ1MjAwNTM5Ml5BMl5BanBnXkFtZTYwNDM0MTc3.jpg,"['United States', 'France']","Nine years after Jesse and Celine first met, they encounter each other again on the French leg of Jesse's book tour.",tt0756683,tt0907657,tt0118694,tt0374546,https://www.youtube.com/embed/oI3UuneLcyU,https://Trailers.to/player/embed/imdb/tt0381681
434,tt0497465,Vicky Cristina Barcelona,Comedy,249322.0,2008.0,96.0,7.1,https://m.media-amazon.com/images/M/MV5BNjVkZGE1OWItYjMzNC00ZTcwLThiODAtYmYwNzJkMjk5OTVhXkEyXkFqcGdeQXVyMTMxODk2OTU@.jpg,"['Spain', 'United States']","Two friends on a summer holiday in Spain become enamored with the same painter, unaware that his ex-wife, with whom he has a tempestuous relationship, is about to re-enter the picture",tt0970468,tt1178663,tt1185836,tt1244668,https://www.youtube.com/embed/B-RdUcXAKiw,https://Trailers.to/player/embed/imdb/tt0497465
435,tt0437086,Alita: Battle Angel,Action,249267.0,2019.0,122.0,7.3,https://m.media-amazon.com/images/M/MV5BMTQzYWYwYjctY2JhZS00NTYzLTllM2UtZWY5ZTk0NmYwYzIyXkEyXkFqcGdeQXVyMzgxODM4NjM@.jpg,"['United States', 'Japan', 'Canada']","A deactivated cyborg's revived, but can't remember anything of her past and goes on a quest to find out who she is.",tt0437086,tt3967856,tt6320628,tt6146586,https://www.youtube.com/embed/5yBV0Fjtma8,https://Trailers.to/player/embed/imdb/tt0437086
436,tt0221027,Blow,Biography,249226.0,2001.0,124.0,7.6,https://m.media-amazon.com/images/M/MV5BYjg5ZDkzZWEtZDQ2ZC00Y2ViLThhMzYtMmIxZDYzYTY2Y2Y2XkEyXkFqcGdeQXVyODAwMTU1MTE@.jpg,"['United States', 'Mexico']","The story of how George Jung, along with the Medellín Cartel headed by Pablo Escobar, established the American cocaine market in the 1970s in the United States",tt0171804,tt0120679,tt0426578,tt0119008,https://www.youtube.com/embed/scWkP1GdnuU,https://Trailers.to/player/embed/imdb/tt0221027
437,tt5727208,Uncut Gems,Crime,248857.0,2019.0,135.0,7.4,https://m.media-amazon.com/images/M/MV5BZDhkMjUyYjItYWVkYi00YTM5LWE4MGEtY2FlMjA3OThlYmZhXkEyXkFqcGdeQXVyODk4OTc3MTY@.jpg,['United States'],"With his debts mounting and angry collectors closing in, a fast-talking New York City jeweler risks everything in hope of staying afloat and alive",tt5580266,tt5390504,tt1872194,tt4633690,https://www.youtube.com/embed/PDN4TPp5lkU,https://Trailers.to/player/embed/imdb/tt5727208
438,tt0104257,Des hommes d'honneur,Drama,248807.0,1992.0,138.0,7.7,https://m.media-amazon.com/images/M/MV5BMmRlZDQ1MmUtMzE2Yi00YTkxLTk1MGMtYmIyYWQwODcxYzRlXkEyXkFqcGdeQXVyNTI4MjkwNjA@.jpg,['United States'],Military lawyer Lieutenant Daniel Kaffee defends Marines accused of murder. They contend they were acting under orders,tt0107943,tt0114388,tt0112579,tt0108211,https://www.youtube.com/embed/uTE592ryZx4,https://Trailers.to/player/embed/imdb/tt0104257
439,tt0113189,GoldenEye,Action,248779.0,1995.0,130.0,7.2,https://m.media-amazon.com/images/M/MV5BMzk2OTg4MTk1NF5BMl5BanBnXkFtZTcwNjExNTgzNA@@.jpg,"['United Kingdom', 'United States']","Years after a friend and fellow 00 agent is killed on a joint mission, a secret space based weapons program known as ""GoldenEye"" is stolen. James Bond sets out to stop a Russian crime syndicate from using the weapon",tt0120201,tt0107206,tt0119094,tt0120660,https://www.youtube.com/embed/0KF2XpFyxXk,https://Trailers.to/player/embed/imdb/tt0113189
440,tt0111503,True Lies - Le caméléon,Action,248619.0,1994.0,141.0,7.2,https://m.media-amazon.com/images/M/MV5BYzg5YmUyNGMtMThiNS00MjA2LTgwZDctNDlhM2RkZDNmZmRkXkEyXkFqcGdeQXVyNDk3NzU2MTQ@.jpg,['United States'],"A fearless, globe-trotting, terrorist-battling secret agent has his life turned upside down when he discovers his wife might be having an affair with a used-car salesman while terrorists smuggle nuclear war heads into the United States",tt0114558,tt0119094,tt0113189,tt0120768,https://www.youtube.com/embed/Uz45Y50ozxE,https://Trailers.to/player/embed/imdb/tt0111503
441,tt0824747,L'échange,Biography,247610.0,2008.0,141.0,7.7,https://m.media-amazon.com/images/M/MV5BOTA1Mzg3NjIxNV5BMl5BanBnXkFtZTcwNzU2NTc5MQ@@.jpg,['United States'],Grief-stricken mother Christine Collins (Angelina Jolie) takes on the L.A.P.D. to her own detriment when it tries to pass off an obvious impostor as her missing child,tt0450188,tt0358273,tt1210166,tt0878804,https://www.youtube.com/embed/tAz9Aqbpcco,https://Trailers.to/player/embed/imdb/tt0824747
442,tt0363547,L'armée des morts,Action,247582.0,2004.0,101.0,7.3,https://m.media-amazon.com/images/M/MV5BN2M2ZmU2OGQtNmU5Yi00MTIyLTgwNWMtYjljMzZlYTdiNjBhXkEyXkFqcGdeQXVyNTAyODkwOQ@@.jpg,"['United States', 'Canada', 'Japan', 'France']","A nurse, a policeman, a young married couple, a salesman and other survivors of a worldwide plague that is producing aggressive, flesh-eating zombies, take refuge in a mega Midwestern shopping mall",tt0375912,tt0385700,tt0372588,tt0399146,https://www.youtube.com/embed/Aq-oVyxJJUs,https://Trailers.to/player/embed/imdb/tt0363547
443,tt1032755,RocknRolla,Action,244197.0,2008.0,114.0,7.3,https://m.media-amazon.com/images/M/MV5BMTQ0NTk5Mzk2OV5BMl5BanBnXkFtZTcwMDE3NTE4MQ@@.jpg,"['United Kingdom', 'United States', 'France']","When a Russian mobster orchestrates a crooked land deal, millions of dollars are up for grabs, drawing in the entire London underworld into a feeding frenzy at a time when the old criminal regime is losing turf to a wealthy foreign mob",tt1029235,tt1197624,tt0462504,tt0404390,https://www.youtube.com/embed/TdpR8VuvbCM,https://Trailers.to/player/embed/imdb/tt1032755
444,tt7349662,BlacKkKlansman,Biography,243752.0,2018.0,135.0,7.5,https://m.media-amazon.com/images/M/MV5BMjUyOTE1NjI0OF5BMl5BanBnXkFtZTgwMTM4ODQ5NTM@.jpg,['United States'],"Ron Stallworth, an African American police officer from Colorado Springs, CO, successfully manages to infiltrate the local Ku Klux Klan branch with the help of a Jewish surrogate who eventually becomes its leader. Based on actual events",tt3513548,tt4916630,tt4209788,tt9071322,https://www.youtube.com/embed/mHm6l8dZyyU,https://Trailers.to/player/embed/imdb/tt7349662
445,tt1001526,Megamind,Action,243109.0,2010.0,95.0,7.3,https://m.media-amazon.com/images/M/MV5BMTAzMzI0NTMzNDBeQTJeQWpwZ15BbWU3MDM3NTAyOTM@.jpg,['United States'],"Evil genius Megamind finally defeats his do-gooder nemesis, Metro Man, but is left without a purpose in a superhero-free world",tt1446192,tt1302011,tt1289406,tt1149361,https://www.youtube.com/embed/6CJUQr4Vs40,https://Trailers.to/player/embed/imdb/tt1001526
446,tt0358273,Walk the Line,Biography,242572.0,2005.0,136.0,7.8,https://m.media-amazon.com/images/M/MV5BMjIyOTU3MjUxOF5BMl5BanBnXkFtZTcwMTQ0NjYzMw@@.jpg,"['United States', 'Germany']","A chronicle of country music legend Johnny Cash's life, from his early days on an Arkansas cotton farm to his rise to fame with Sun Records in Memphis, where he recorded alongside Elvis Presley, Jerry Lee Lewis, and Carl Perkins.",tt0412080,tt0824747,tt0450188,tt0352248,https://www.youtube.com/embed/pbQ22zWPYbw,https://Trailers.to/player/embed/imdb/tt0358273
447,tt0448134,Sunshine,Sci-Fi,242384.0,2007.0,107.0,7.2,https://m.media-amazon.com/images/M/MV5BMTU5Nzg2OTk2NF5BMl5BanBnXkFtZTYwNTc1ODM3.jpg,"['United Kingdom', 'United States']",A team of international astronauts are sent on a dangerous mission to reignite the dying Sun with a nuclear fission bomb in 2057,tt1219289,tt0468489,tt0424880,tt0898367,https://www.youtube.com/embed/r8BSlqHAhuY,https://Trailers.to/player/embed/imdb/tt0448134
448,tt0396171,Le Parfum : Histoire d'un meurtrier,Crime,242011.0,2006.0,147.0,7.5,https://m.media-amazon.com/images/M/MV5BMTg2Mzk2NjkzNl5BMl5BanBnXkFtZTYwMzIzOTc2.jpg,"['Germany', 'France', 'Spain', 'United States', 'Belgium']","Jean-Baptiste Grenouille, born with a superior olfactory sense, creates the world's finest perfume. His work, however, takes a dark turn as he searches for the ultimate scent.",tt1343097,tt0443706,tt0362225,tt0181865,https://www.youtube.com/embed/zutiIw_2e2g,https://Trailers.to/player/embed/imdb/tt0396171
449,tt3450958,La Planète des singes : Suprématie,Action,240954.0,2017.0,140.0,7.4,https://m.media-amazon.com/images/M/MV5BNDNmYTQzMDEtMmY0MS00OTNjLTk4MjItMDZhMzkzOGI3MzA0XkEyXkFqcGdeQXVyNjk5NDA3OTk@.jpg,"['United States', 'Canada', 'New Zealand']","After the apes suffer unimaginable losses, Caesar wrestles with his darker instincts and begins his own mythic quest to avenge his kind",tt0451279,tt1677720,tt2250912,tt4572514,https://www.youtube.com/embed/yDBFrQvfGlQ,https://Trailers.to/player/embed/imdb/tt3450958
450,tt5726616,Call Me by Your Name,Drama,240457.0,2017.0,132.0,7.9,https://m.media-amazon.com/images/M/MV5BNDk3NTEwNjc0MV5BMl5BanBnXkFtZTgwNzYxNTMwMzI@.jpg,"['Italy', 'France', 'United States', 'Brazil']","In 1980s Italy, romance blossoms between a seventeen-year-old student and the older man hired as his father's research assistant.",tt4034228,tt3281548,tt6155172,tt2213054,https://www.youtube.com/embed/_IBft4jvWZ0,https://Trailers.to/player/embed/imdb/tt5726616
451,tt0837562,Hôtel Transylvanie,Adventure,238754.0,2012.0,91.0,7.1,https://m.media-amazon.com/images/M/MV5BMTM3NjQyODI3M15BMl5BanBnXkFtZTcwMDM4NjM0OA@@.jpg,"['United States', 'South Korea', 'Canada']","Dracula, who operates a high-end resort away from the human world, goes into overprotective mode when a boy discovers the resort and falls for the count's teenaged daughter.",tt1217209,tt2179116,tt1430607,tt2452042,https://www.youtube.com/embed/M2s-6_NGaOE,https://Trailers.to/player/embed/imdb/tt0837562
452,tt0825232,Sans plus attendre,Adventure,238615.0,2007.0,97.0,7.4,https://m.media-amazon.com/images/M/MV5BMTY2NTUyMjIyNF5BMl5BanBnXkFtZTYwNzYwMDM4.jpg,['United States'],Two terminally ill men escape from a cancer ward and head off on a road trip with a wish list of to-dos before they die,tt0407265,tt0462538,tt1127715,tt0838221,https://www.youtube.com/embed/f-eyQswdc-c,https://Trailers.to/player/embed/imdb/tt0825232
453,tt2361509,Le Nouveau Stagiaire,Comedy,238222.0,2015.0,121.0,7.1,https://m.media-amazon.com/images/M/MV5BMTUyNjE5NjI5OF5BMl5BanBnXkFtZTgwNzYzMzU3NjE@.jpg,['United States'],"Seventy-year-old widower Ben Whittaker has discovered that retirement isn't all it's cracked up to be. Seizing an opportunity to get back in the game, he becomes a senior intern at an online fashion site, founded and run by Jules Ostin.",tt2910904,tt4176826,tt3464902,tt3792960,https://www.youtube.com/embed/324pojjHOhI,https://Trailers.to/player/embed/imdb/tt2361509
454,tt1033575,The Descendants,Comedy,237332.0,2011.0,115.0,7.3,https://m.media-amazon.com/images/M/MV5BMjAyNTA1MTcyN15BMl5BanBnXkFtZTcwNjEyODczNQ@@.jpg,['United States'],A land baron tries to reconnect with his two daughters after his wife is seriously injured in a boating accident,tt1570728,tt1931533,tt1412386,tt1714915,https://www.youtube.com/embed/ZY6vP__nSik,https://Trailers.to/player/embed/imdb/tt1033575
455,tt3464902,The Lobster,Comedy,237272.0,2015.0,119.0,7.2,https://m.media-amazon.com/images/M/MV5BNDQ1NDE5NzQ1NF5BMl5BanBnXkFtZTgwNzA5OTM2NTE@.jpg,"['Ireland', 'United Kingdom', 'Greece', 'France', 'Netherlands', 'United States']","In a dystopian near future, single people, according to the laws of The City, are taken to The Hotel, where they are obliged to find a romantic partner in forty-five days or are transformed into beasts and sent off into The Woods",tt2910904,tt1322269,tt2361509,tt4385888,https://www.youtube.com/embed/fpt0tn1-54k,https://Trailers.to/player/embed/imdb/tt3464902
456,tt0976051,The Reader,Drama,237076.0,2008.0,124.0,7.6,https://m.media-amazon.com/images/M/MV5BMTM0NDQxNjA0N15BMl5BanBnXkFtZTcwNDUwMzcwMg@@.jpg,"['Germany', 'United States']","Post-WWII Germany: Nearly a decade after his affair with an older woman came to a mysterious end, law student Michael Berg re-encounters his former lover as she defends herself in a war-crime trial",tt0976051,tt0814314,tt0419887,tt1068646,https://www.youtube.com/embed/JA1J2WmFGUw,https://Trailers.to/player/embed/imdb/tt0976051
457,tt1855199,End of Watch,Action,236948.0,2012.0,109.0,7.6,https://m.media-amazon.com/images/M/MV5BMjMxNjU0ODU5Ml5BMl5BanBnXkFtZTcwNjI4MzAyOA@@.jpg,['United States'],"Shot documentary-style, this film follows the daily grind of two young police officers in LA who are partners and friends, and what happens when they meet criminal forces greater than themselves",tt1318514,tt1386932,tt1899353,tt0446029,https://www.youtube.com/embed/EdfhTzexQRQ,https://Trailers.to/player/embed/imdb/tt1855199
458,tt0309698,Identity,Mystery,236655.0,2003.0,90.0,7.3,https://m.media-amazon.com/images/M/MV5BMjE2NzgyNDYzNl5BMl5BanBnXkFtZTYwODM2Nzc2.jpg,['United States'],"Stranded at a desolate Nevada motel during a nasty rain storm, ten strangers become acquainted with each other when they realize that they're being killed off one by one.",tt0480669,tt0139809,tt1937149,tt7057496,https://www.youtube.com/embed/TQkG2x3qTf4,https://Trailers.to/player/embed/imdb/tt0309698
459,tt1655442,The Artist,Comedy,236608.0,2011.0,100.0,7.9,https://m.media-amazon.com/images/M/MV5BMDUyZWU5N2UtOWFlMy00MTI0LTk0ZDYtMzFhNjljODBhZDA5XkEyXkFqcGdeQXVyNzA4ODc3ODU@.jpg,"['France', 'Belgium', 'United States']",An egomaniacal film star develops a relationship with a young dancer against the backdrop of Hollywood's silent era.,tt1748122,tt0780536,tt1119646,tt1605783,https://www.youtube.com/embed/qjCQmpNkBI4,https://Trailers.to/player/embed/imdb/tt1655442
460,tt0985699,Walkyrie,Drama,235679.0,2008.0,121.0,7.1,https://m.media-amazon.com/images/M/MV5BMTg3Njc2ODEyN15BMl5BanBnXkFtZTcwNTAwMzc3NA@@.jpg,"['United States', 'Germany', 'Italy', 'Spain', 'France', 'Japan', 'United Kingdom']","A dramatization of the July 20, 1944 assassination and political coup plot by desperate renegade German Army officers against Adolf Hitler during World War II",tt0469623,tt1228987,tt0790712,tt1340800,https://www.youtube.com/embed/oYBR82wSQxY,https://Trailers.to/player/embed/imdb/tt0985699
461,tt1212450,Des hommes sans loi,Crime,235562.0,2012.0,116.0,7.3,https://m.media-amazon.com/images/M/MV5BMjAxNjUyNjUwN15BMl5BanBnXkFtZTcwMDgwOTIyOA@@.jpg,['United States'],"Set in Depression-era Franklin County, Virginia, a trio of bootlegging brothers are threatened by a new special deputy and other authorities angling for a cut of their profits",tt1189340,tt1313092,tt1670345,tt0926762,https://www.youtube.com/embed/HK-Q3wYsOgA,https://Trailers.to/player/embed/imdb/tt1212450
462,tt0765443,Les Promesses de l'ombre,Action,235535.0,2007.0,100.0,7.6,https://m.media-amazon.com/images/M/MV5BMTcwMzU0OTY3NF5BMl5BanBnXkFtZTYwNzkwNjg2.jpg,"['United Kingdom', 'Canada', 'United States']",A teenager who dies during childbirth leaves clues in her journal that could tie her child to a rape involving a violent Russian mob family,tt0446059,tt0441773,tt0347246,tt0373074,https://www.youtube.com/embed/tNnkDFOD7J0,https://Trailers.to/player/embed/imdb/tt0765443
463,tt0120660,Ennemi d'état,Action,235529.0,1998.0,132.0,7.3,https://m.media-amazon.com/images/M/MV5BMWI0Y2NhMzMtYTE5ZS00MDlhLTg0ZjEtMjAwZmEwNTc0ODc2XkEyXkFqcGdeQXVyNjU0OTQ0OTY@.jpg,['United States'],A lawyer becomes targeted by a corrupt politician and his N.S.A. goons when he accidentally receives key evidence to a politically motivated crime,tt0120201,tt0120768,tt0119094,tt0117500,https://www.youtube.com/embed/LwbNYKBKb70,https://Trailers.to/player/embed/imdb/tt0120660
464,tt0414993,The Fountain,Drama,234452.0,2006.0,97.0,7.2,https://m.media-amazon.com/images/M/MV5BMTU5OTczMTcxMV5BMl5BanBnXkFtZTcwNDg3MTEzMw@@.jpg,"['Canada', 'United States']","As a modern-day scientist, Tommy is struggling with mortality, desperately searching for the medical breakthrough that will save the life of his cancer-stricken wife, Izzi",tt0398808,tt1379182,tt0366627,tt0468489,https://www.youtube.com/embed/HHaJY6SL7GE,https://Trailers.to/player/embed/imdb/tt0414993
465,tt0144117,Les anges de Boston,Action,233591.0,1999.0,108.0,7.7,https://m.media-amazon.com/images/M/MV5BYzVmMTdjOTYtOTJkYS00ZTg2LWExNTgtNzA1N2Y0MDgwYWFhXkEyXkFqcGdeQXVyMTQxNzMzNDI@.jpg,"['United States', 'Canada']",Two Irish Catholic brothers become vigilantes and wipe out Boston's criminal underworld in the name of God.,tt0216651,tt0260991,tt0266308,tt0117731,https://www.youtube.com/embed/5CKb1XHh3jQ,https://Trailers.to/player/embed/imdb/tt0144117
466,tt1832382,Une séparation,Drama,233320.0,2011.0,123.0,8.3,https://m.media-amazon.com/images/M/MV5BN2JmMjViMjMtZTM5Mi00ZGZkLTk5YzctZDg5MjFjZDE4NjNkXkEyXkFqcGdeQXVyMTMxODk2OTU@.jpg,"['Iran', 'France', 'Australia']",A married couple are faced with a difficult decision - to improve the life of their child by moving to another country or to stay in Iran and look after a deteriorating parent who has Alzheimer's disease.,tt1255953,tt2106476,tt1305806,tt1639426,https://www.youtube.com/embed/58Onuy5USTc,https://Trailers.to/player/embed/imdb/tt1832382
467,tt0107818,Philadelphia,Drama,233082.0,1993.0,125.0,7.7,https://m.media-amazon.com/images/M/MV5BNDE0MWE1ZTMtOWFkMS00YjdiLTkwZTItMDljYjY3MjM0NTk5XkEyXkFqcGdeQXVyNDYyMDk5MTU@.jpg,['United States'],"When a man with HIV is fired by his law firm because of his condition, he hires a homophobic small time lawyer as the only willing advocate for a wrongful dismissal suit",tt0108550,tt0107822,tt0107943,tt0110148,https://www.youtube.com/embed/2zmy91OrGMA,https://Trailers.to/player/embed/imdb/tt0107818
468,tt0245712,Amours chiennes,Drama,232934.0,2000.0,154.0,8.1,https://m.media-amazon.com/images/M/MV5BMjQxMWJhMzMtMzllZi00NzMwLTllYjktNTcwZmU4ZmU3NTA0XkEyXkFqcGdeQXVyMTAzMDM4MjM0.jpg,['Mexico'],"A horrific car accident connects three stories, each involving characters dealing with loss, regret, and life's harsh realities, all in the name of love.",tt0166924,tt0118749,tt0120731,tt0428870,https://www.youtube.com/embed/XToRtfQbeHg,https://Trailers.to/player/embed/imdb/tt0245712
469,tt0134847,Pitch Black,Action,232363.0,2000.0,109.0,7.1,https://m.media-amazon.com/images/M/MV5BNTNmYzE1OWYtZDdjNC00OTdhLTg1YjUtYWJlZTVkMzkzNmVkXkEyXkFqcGdeQXVyMTQxNzMzNDI@.jpg,"['United States', 'Australia']","A commercial transport ship and its crew are marooned on a planet full of bloodthirsty creatures that only come out to feast at night. But then, they learn that a month-long eclipse is about to occur",tt0120188,tt0120784,tt0137363,tt0368909,https://www.youtube.com/embed/4n36ennMDs8,https://Trailers.to/player/embed/imdb/tt0134847
470,tt0315733,21 grammes,Crime,231377.0,2003.0,124.0,7.6,https://m.media-amazon.com/images/M/MV5BMjA4MjI2OTM5N15BMl5BanBnXkFtZTcwNDA1NjUzMw@@.jpg,['United States'],"A freak accident brings together a critically ill mathematician, a grieving mother, and a born-again ex-con",tt0383694,tt0310775,tt0315983,tt0289992,https://www.youtube.com/embed/x_tPi8pYzSw,https://Trailers.to/player/embed/imdb/tt0315733
